title,tag,link,date,description,content
Kenali Gejala dari Penyakit Herpes,,https://www.biofarma.co.id/id/announcement/detail/kenali-gejala-dari-penyakit-herpes,"Senin, 6 Januari 2025","Herpes adalah virus yang menyerang kulit dan selaput lendir manusia. Herpes dapat menular melalui kontak kulit, air liur, oral seks, maupun hubungan seksual dengan penderita herpes.","Pernahkah Anda mengalami ruam atau bintik-bintik merah di kulit? Hati-hati, gejala tersebut dapat menjadi tanda penyakit herpes.
Apa itu Herpes?
Herpes adalah virus yang menyerang kulit dan selaput lendir manusia. Herpes dapat menular melalui kontak kulit, air liur, oral seks, maupun hubungan seksual dengan penderita herpes. Virus herpes dapat menyerang siapa saja, baik pria maupun wanita, dan menyebar melalui kontak langsung dengan kulit yang terinfeksi. Gejalanya dapat berupa ruam kemerahan, bintik-bintik yang terasa perih, hingga lepuhan yang muncul di area mulut atau area genital. Herpes tidak dapat disembuhkan sepenuhnya, tetapi gejalanya bisa dikontrol dengan pengobatan yang tepat.
Jenis-Jenis Herpes
Herpes merupakan virus yang berasal dari kelompok alfa-herpesvirus. Virus dari kelompok ini terbagi kedalam beberapa macam kelompok, diantaranya adalah virus Herpes Simplex terbagi menjadi dua tipe, yaitu HSV-1 (herpes simplex virus tipe-1) dan HSV-2 (herpes simplex virus tipe-2). Kedua tipe ini memiliki perbedaan lokasi infeksi:
Herpes simplex virus tipe-1 (HSV-1):
Biasanya menyerang area mulut dan wajah.
Ditandai dengan ruam atau bisul di sekitar mulut yang sering disebut cold sores.
Dapat menular melalui kontak langsung dengan ruam, air liur, atau penggunaan peralatan makan yang sama.
Herpes simplex virus tipe-2 (HSV-2):
Menyerang area genital dan sekitar anus.
Biasanya ditularkan melalui kontak seksual.
Gejalanya meliputi bisul pada alat kelamin, disertai demam, nyeri tubuh, dan pembengkakan kelenjar getah bening.
Selain HSV, ada juga jenis herpes lain yaitu Herpes Zoster yang disebabkan oleh virus Varicella Zoster (VZV). Virus ini merupakan penyebab cacar air yang dapat aktif kembali dalam tubuh setelah infeksi awal. Herpes Zoster sering disebut sebagai ""shingles"" dan biasanya menyerang orang dewasa yang sebelumnya pernah terkena cacar air. Infeksi ini dapat menyebabkan nyeri yang hebat dan berisiko komplikasi serius.
Gejala Penyakit Herpes
Gejala herpes dapat bervariasi tergantung pada jenis dan lokasi infeksinya. Terdapat beberapa gejala umum yang biasanya dialami oleh penderita herpes, di antaranya adalah:
Herpes simplex virus tipe-1 (HSV-1):
Blister atau luka terbuka di sekitar mulut.
Sensasi kesemutan, gatal, atau terbakar sebelum ruam muncul.
Herpes simplex virus tipe-2 (HSV-2):
Luka atau bisul di area genital.
Demam dan nyeri tubuh.
Pembengkakan kelenjar getah bening.
Herpes Zoster:
Ruam atau bisul di satu sisi tubuh, biasanya di area punggung atau dada.
Nyeri hebat pada area yang terkena.
Gejala lain seperti demam, sakit kepala, dan meriang.
Komplikasi yang Mungkin Terjadi
Herpes dapat menyebabkan komplikasi serius pada individu dengan sistem imun rendah, seperti penderita HIV atau pasien pasca operasi. Herpes juga dapat mengakibatkan komplikasi lain seperti infeksi mata yang mengakibatkan kebutaan, meningoensefalitis (infeksi otak), bahkan hingga neonatal herpes yang berisiko fatal pada bayi.
Penularan Herpes
Herpes dapat menyerang siapapun dari berbagai kelompok usia. Tetapi, penularan virus ini lebih banyak menyerang orang-orang yang sering melakukan kontak dengan penderita Herpes. Selain itu, penularan penyakit Herpes juga dapat terjadi karena hal-hal berikut:  
Kontak kulit langsung, termasuk saat berciuman atau menyentuh ruam.
Hubungan seksual tanpa pengaman.
Berbagi peralatan makan, handuk, atau pisau cukur.
Penularan dari ibu ke bayi saat proses persalinan (neonatal herpes)
Pencegahan Herpes
Meskipun herpes tidak bisa disembuhkan, virus herpes dapat ""tertidur"" di dalam tubuh dan kambuh ketika dipicu oleh faktor-faktor seperti stres, penurunan imunitas, atau kondisi fisik tertentu. Namun, gejala dan keparahannya dapat dikurangi dengan mengonsumsi obat-obat yang diresepkan oleh dokter. Untuk mencegah penyakit herpes, berikut langkah-langkah yang dapat diambil:
Hindari kontak langsung dengan penderita, terutama saat terdapat ruam atau bisul.
Jangan berbagi peralatan makan, handuk, atau pisau cukur.
Gunakan kondom saat berhubungan seksual untuk mengurangi risiko penularan.
Hindari seks oral jika pasangan memiliki gejala herpes mulut.
Herpes tidak hanya memengaruhi fisik, tetapi juga dapat berdampak emosional dan sosial. Banyak penderita merasa malu atau enggan untuk mencari bantuan medis karena stigma yang melekat pada penyakit ini. Namun, penting untuk diingat bahwa herpes adalah penyakit umum yang dapat diatasi dengan dukungan dan pengobatan yang tepat.
Jika Anda atau orang terdekat Anda mengalami gejala yang mirip dengan herpes, jangan ragu untuk berkonsultasi dengan dokter. Pengobatan dini dapat membantu mengurangi gejala, mencegah komplikasi, dan meningkatkan kualitas hidup. Ingatlah, kesehatan Anda adalah prioritas utama, dan tidak ada yang salah dengan mencari bantuan profesional ketika Anda membutuhkannya.
  Referensi
Anti Non Retro Virus (Herpes). (2023, November 8). Yankes Kemkes. Retrieved January 2, 2025, from yankes.kemkes.go.id
Ensefalitis herpes simplex. (2022, August 2). Yankes Kemkes. Retrieved January 2, 2025, from yankes.kemkes.go.id
Herpes simplex virus. (2024, December 11). World Health Organization (WHO). Retrieved January 3, 2025, from https://www.who.int/en/news-room/fact-sheets/detail/herpes-simplex-virus
Whitley, R. J., Kimberlin, D. W., & Roizman, B. (1998). Herpes Simplex Viruses. Clinical Infectious Diseases, 26(3), 542-553.
Bagikan:
Download"
Manfaat Leunca untuk Kesehatan,,https://www.biofarma.co.id/id/announcement/detail/manfaat-leunca-untuk-kesehatan,"Jumat, 3 Januari 2025",Leunca atau yang dikenal juga dengan nama latin (Solanum nigrum) adalah tanaman dengan buah kecil berwarna hijau hingga ungu tua dengan tekstur lembut,"Leunca atau yang dikenal juga dengan nama latin (Solanum nigrum) adalah tanaman dengan buah kecil berwarna hijau hingga ungu tua dengan tekstur lembut, leunca berasal dari Amerika Selatan dan menyebar ke berbagai negara di Eropa, Afrika, dan Asia, termasuk di Indonesia. 
Di Indoensia sendiri Leunca sering dijadikan sebagai lalapan atau bahan untuk membuat sambal, meskipun hanya digunakan sebagai bahan makanan saja ternyata buah ini menyimpan nutrisi yang melimpah, sehingga dapat memberikan manfaat bagi kesehatan.  
Ingin tahu apa saja manfaat leunca untuk kesehatan? Ayo, simak informasi lengkapnya dalam artikel berikut ini!
Kandungan Nutrisi dalam Buah Leunca
Berdasarkan Data Komposisi Pangan Indonesia dari Kementerian Kesehatan RI, setiap 100 gram leunca segar mengandung berbagai nutrisi penting, antara lain:
Kalori: 49 kkal
Protein: 3,6 gram
Karbohidrat: 7,2 gram
Serat: 1,9 gram
Kalsium: 210 mg
Fosfor: 90 mg
Zat Besi: 2,8 mg
Selain itu, leunca juga kaya akan vitamin, seperti vitamin A dan C, beta karoten, zinc serta sejumlah antioksidan alami yang memiliki banyak manfaat bagi kesehatan tubuh.
Manfaat Leunca Bagi Kesehatan
Menjaga Kesehatan Mata 
Salah satu khasiat leunca untuk tubuh adalah menjaga kesehatan mata, berkat kandungan vitamin A yang ada di dalamnya. Vitamin A adalah nutrisi penting yang diperlukan oleh mata untuk memproduksi rhodopsin, pigmen yang memungkinkan penglihatan dengan jelas dalam kondisi gelap. Kekurangan vitamin A dapat meningkatkan risiko rabun senja. Selain itu, menurut American Academy of Ophthalmology, vitamin A juga berperan dalam menutrisi mata dan menjaga kelembapannya, sehingga mencegah terjadinya mata kering.
Menjaga Daya Tahan Tubuh
Manfaat leunca lainnya bagi kesehatan adalah mendukung sistem kekebalan tubuh, berkat kandungan vitamin C yang dimilikinya. Vitamin C berperan dalam meningkatkan jumlah sel darah putih, yang berfungsi melindungi tubuh dari infeksi bakteri atau virus. Selain itu, sebagai antioksidan, vitamin C juga melindungi tubuh dari dampak radikal bebas yang dapat merusak sel-sel imun. Dengan demikian, sistem kekebalan tubuh dapat berfungsi secara optimal dalam melawan berbagai penyakit.
Mampu Mengontrol Kadar Gula Darah
leunca juga dapat membantu mengatur kadar gula darah. senyawa saponin yang terkandung dalam leunca dapat menurunkan kadar gula darah. Saponin diketahui dapat merangsang pelepasan insulin dan mengurangi resistensi insulin, sehingga tubuh dapat memanfaatkan insulin dengan lebih efektif dalam mengontrol kadar gula darah. 
Dapat mendukung perlambatan proses penuaan
selain bermanfaat dalam mengatur gula darah, Leunca juga ternyata sangat bermanfaat bagi kesehatan kulit. Kandungan protein, lemak, dan antioksidan pada leunca dapat mendukung perbaikan dan regenerasi jaringan kulit yang rusak. Dengan demikian, kulit akan menjadi lebih sehat, dan tanda-tanda penuaan dini, seperti garis halus, bintik hitam, serta kulit kusam, dapat berkurang.
Mengatasi Risiko Osteoporosis
Kandungan kalsium, fosfor, dan vitamin K dalam leunca berperan penting dalam menjaga kekuatan dan kesehatan tulang, serta mencegah osteoporosis, terutama pada lansia, dengan meningkatkan penyerapan kalsium dan kepadatan mineral tulang; selain itu, vitamin C yang terkandung dalam leunca juga berfungsi untuk memperkuat tulang dengan merangsang pembentukan osteoblas, sel yang membentuk tulang baru.
Mencegah Perkembangan Kanker
Beberapa penelitian menunjukkan bahwa leunca memiliki potensi dalam mencegah perkembangan beberapa jenis kanker, seperti kanker hati, payudara, dan lambung. Leunca mengandung senyawa polisakarida, solamargine, dan antosianin yang dapat menghambat pertumbuhan sel-sel kanker. Selain itu, nutrisi yang terdapat dalam leunca juga dapat memperkuat fungsi sistem kekebalan tubuh dalam melawan pertumbuhan sel kanker. Namun, efektivitas leunca sebagai pengobatan kanker masih memerlukan penelitian lebih lanjut.
Meski memiliki banyak manfaat, leunca juga memiliki efek samping. Leunca mengandung solanin yang dapat menyebabkan iritasi lambung atau keracunan jika dikonsumsi secara berlebihan, terutama jika buahnya belum matang. Jika muncul gejala keracunan, seperti pusing, sakit kepala, nyeri perut, diare, mual, atau muntah setelah mengonsumsi leunca, segera periksakan diri ke dokter untuk mendapatkan penanganan yang tepat. Sebaiknya, konsultasikan terlebih dahulu dengan dokter jika berencana memanfaatkan leunca untuk mengatasi kondisi tertentu.
  Referensi
Hellosehat. “Tidak Hanya Jadi Lalapan, Ini 10 Manfaat Leunca untuk Tubuh” Hellosehat. 2024
halodoc. “Kecil tapi Banyak Khasiat, Ketahui 5 Manfaat Leunca untuk Kesehatan Tubuh” halodoc. 2024
ALODOCTER. “Leunca, Ini Kandungan Nutrisi dan Manfaatnya untuk Kesehatan” ALODOCTER. 2024
Bagikan:
Download"
Kenali Gejala Sakit Maag dan Penyebabnya untuk Pencegahan Dini,,https://www.biofarma.co.id/id/announcement/detail/kenali-gejala-sakit-maag-dan-penyebabnya-untuk-pencegahan-dini,"Jumat, 3 Januari 2025","Maag atau gastritis adalah peradangan pada lapisan lambung yang sering kali dianggap ringan, tetapi jika tidak ditangani dengan tepat, maag dapat berkembang menjadi masalah yang lebih serius.","Maag atau gastritis adalah peradangan pada lapisan lambung yang sering kali dianggap ringan, tetapi jika tidak ditangani dengan tepat, maag dapat berkembang menjadi masalah yang lebih serius. Penyakit maag ini bisa terjadi secara akut atau kronis. 
Menurut data dari Departemen Kesehatan Republik Indonesia, maag termasuk dalam 10 penyakit terbanyak yang diderita pasien rawat inap di rumah sakit dan puskesmas. Maag yang tidak ditangani dengan baik dapat menyebabkan komplikasi seperti tukak lambung, pendarahan saluran pencernaan, dan gangguan cairan serta elektrolit yang berisiko mengancam nyawa. Oleh karena itu, penting untuk mengetahui gejala dan penyebab maag agar bisa melakukan pencegahan maag dengan cara yang tepat.
Gejala Sakit Maag
Gejala sakit maag sering kali muncul secara berulang, dan beberapa gejala umum yang sering dirasakan penderita maag adalah sebagai berikut:
Mudah merasa kenyang meskipun makan sedikit.
Mual dan perut terasa penuh atau kembung.
Sering bersendawa setelah makan.
Nyeri pada ulu hati atau di tengah dada yang bisa muncul setelah makan, yang sering menandakan gejala maag.
Perut bagian atas terasa panas, akibat asam lambung yang naik ke kerongkongan, menyebabkan rasa panas atau terbakar yang dikenal dengan heartburn.
Penyebab Maag
Penyebab maag beragam dan bisa dipengaruhi oleh beberapa faktor. Beberapa penyebab maag yang paling umum adalah:
1. Infeksi Helicobacter pylori 
Salah satu penyebab utama dari gastritis, di mana bakteri ini menginfeksi lapisan lambung, menyebabkan peradangan yang bisa berkembang menjadi maag.
2. Makanan yang Tidak Tepat 
Makanan pedas, asam, berlemak, atau olahan sangat berpotensi merangsang produksi asam lambung berlebih yang dapat memperburuk gejala maag.
3. Porsi Makan dan Frekuensi Makan yang Tidak Teratur
Makan dalam porsi yang terlalu banyak atau terlalu sedikit, serta makan dengan interval yang tidak teratur, dapat meningkatkan produksi asam lambung dan memperburuk kondisi maag.
4. Stres 
Stres psikologis dapat memicu peningkatan produksi asam lambung, yang dapat menyebabkan gejala maag lebih sering muncul.
5. Konsumsi Alkohol dan Kopi 
Konsumsi alkohol yang berlebihan dan minum kopi dalam jumlah banyak dapat merusak mukosa lambung, memicu iritasi, dan menyebabkan peradangan, yang berujung pada maag.
6. Merokok 
Merokok dapat meningkatkan produksi asam lambung dan merusak lapisan pelindung lambung.
7. Jenis Kelamin 
Perempuan cenderung lebih rentan terhadap maag karena faktor hormonal dan stres.
Dengan mengetahui penyebab dan gejala maag, kita bisa lebih waspada dan lebih cepat dalam mengambil tindakan preventif untuk mencegah sakit maag. Pencegahan maag yang tepat dan penanganan sejak dini akan mengurangi risiko komplikasi yang dapat berbahaya bagi kesehatan.
  Referensi:
Sinaga, M. D., & Fajrin, A. A. (2022). Sistem pakar diagnosa penyakit asam lambung pada orang dewasa menggunakan metode forward chaining berbasis web. Jurnal Comasie, 7(7).
Zuhair, R. D., Susanti, N., Pranita, M., Jannah, M. M., Zahra, M. U., Saragih, P. A., Harahap, M., Karina, R. L., Fikri, M. A., & Wijaya, M. A. (2023). Hubungan antara pola makan dan stres terhadap kejadian penyakit gastritis di Desa Tembung Kecamatan Percut Sei Tuan. Cendekia Utama: Jurnal Keperawatan dan Kesehatan Masyarakat, 12(2).
Suwindri, Y., Tiranda, Y., & Ningrum, W. A. C. (2021). Faktor penyebab kejadian gastritis di Indonesia: Literature review. Jurnal Keperawatan Merdeka (JKM), 1(2). 
Artikel Hermina Hospitals. (2023). Penyakit Maag: Penyebab, Gejala dan Cara Mengatasinya Agar Tidak Kambuh Lagi.
Bagikan:
Download"
5 Manfaat Buah Sirsak Yang Baik Bagi Tubuh,,https://www.biofarma.co.id/id/announcement/detail/5-manfaat-buah-sirsak-yang-baik-bagi-tubuh,"Kamis, 2 Januari 2025","Buah Sirsak atau Annona muricata adalah buah yang memiliki rasa asam dan manis ketika dimakan. Selain nikmat, sirsak juga memiliki kandungan gizi yang bermanfaat bagi kesehatan.","Tahukah Anda bahwa buah sirsak menyimpan segudang manfaat luar biasa untuk kesehatan? 
Buah Sirsak atau Annona muricata adalah buah yang memiliki rasa asam dan manis ketika dimakan. Selain nikmat, sirsak juga memiliki kandungan gizi yang bermanfaat bagi kesehatan.
Menurut data United States Department of Agriculture (USDA), dalam 100 gram buah sirsak, terdapat berbagai macam nutrisi yang dibutuhkan oleh tubuh, seperti 66 kalori, 1 gram protein, 16.8 gram karbohidrat, 3.3 gram serat, 278 mg kalium, 14 mg kalsium, niasin, riboflavin, dan zat besi. Semua kandungan ini bekerja sama untuk melindungi tubuh dari kerusakan sel dan meningkatkan sistem kekebalan tubuh.
Menariknya, selain daging dari buah sirsak yang biasa kita konsumsi, ternyata daun dan batang dari pohon sirsak juga memiliki banyak manfaat yang baik bagi kesehatan. Dengan manfaatnya yang melimpah, tak heran jika sirsak menjadi pilihan favorit bagi mereka yang ingin menjaga kesehatan secara alami. Berikut adalah beberapa manfaat sirsak untuk kesehatan tubuh:
1. Mengurangi Peradangan 
Salah satu manfaat mengonsumsi buah sirsak adalah untuk untuk mengurangi peradangan. Buah sirsak mengandung antioksidan` tinggi yang berguna untuk melawan radikal bebas dan mengurangi kerusakan sel yang dapat menyebabkan peradangan.
2. Meningkatkan Sistem Imun 
Kandungan antioksidan dan vitamin C dalam buah sirsak berperan penting dalam meningkatkan sistem kekebalan tubuh. Vitamin C dalam buah sirsak berfungsi untuk melawan infeksi dan memperkuat daya tahan tubuh. Sedangkan antioksidan yang terkandung dalam buah sirsak berfungsi untuk mengurangi risiko penyakit kronis seperti hipertensi dan diabetes.
3. Meningkatkan Kesehatan Pencernaan 
Sirsak memiliki banyak kandungan serat yang baik untuk pencernaan. Mengkonsumsi satu gelas sirsak dapat memenuhi 26.5% kebutuhan serat yang dibutuhkan tubuh dalam sehari. Mengonsumsi sirsak secara rutin dapat membantu melancarkan proses pencernaan dan mencegah masalah seperti sembelit..
4. Menghambat Pertumbuhan Sel Kanker 
Baik buah maupun daun sirsak mengandung senyawa antioksidan yang memiliki sifat antikanker. Beberapa penelitian menunjukkan bahwa ekstrak dari buah dan daun sirsak dapat membantu mencegah pertumbuhan sel kanker dalam tubuh.
5. Mencegah Infeksi 
Nutrisi yang terkandung dalam buah sirsak dapat membantu membunuh virus, parasit, dan bakteri. Selain itu, nutrisi ini juga dapat meningkatkan kekebalan tubuh dan mempercepat proses pemulihan setelah tubuh terinfeksi.
6. Membantu Mengontrol Gula Darah
Daun sirsak bermanfaat untuk mengontrol kadar gula darah yang dalam tubuh. Ekstrak daun sirsak mengandung antidiabetes yang dapat membantu untuk mengatur penyerapan gula darah ke dalam tubuh. 
Selain nikmat, buah sirsak juga memberikan banyak manfaat bagi kesehatan tubuh. Jadi, tidak ada salahnya untuk mulai mengonsumsi sirsak secara rutin sebagai langkah menjaga kesehatan secara alami. Selalu ingat untuk tetap menjaga pola makan yang seimbang dan berkonsultasi dengan tenaga medis apabila Anda memiliki kondisi kesehatan tertentu.
  Referensi:
Afzaal, M., Saeed, F., Asghar, A., Shah, Y. A., Ikram, A., Ateeq, H., ... & Chacha, J. S. (2022). Nutritional and therapeutic potential of soursop. Journal of Food Quality, 2022(1), 8828358.
Agu, K. C., & Okolie, P. N. (2017). Proximate composition, phytochemical analysis, and in vitro antioxidant potentials of extracts of Annona muricata (Soursop). Food science & nutrition, 5(5), 1029-1036.
Bhat, R., & Paliyath, G. (2016). Fruits of tropical climates: Dietary importance and health benefits.
Rady, I., Bloch, M. B., Chamcheu, R. C. N., Banang Mbeumi, S., Anwar, M. R., Mohamed, H., ... & Chamcheu, J. C. (2018). Anticancer properties of graviola (Annona muricata): A comprehensive mechanistic review. Oxidative medicine and cellular longevity, 2018(1), 1826170.
Bagikan:
Download"
8 Ragam Manfaat Buah Naga Untuk Kesehatan,,https://www.biofarma.co.id/id/announcement/detail/8-ragam-manfaat-buah-naga-untuk-kesehatan,"Kamis, 19 Desember 2024","Buah naga, yang juga dikenal sebagai pitaya atau dragon fruit, merupakan buah tropis yang tumbuh subur di Indonesia. Buah eksotis ini memiliki ciri khas berupa kulit merah tebal dengan sisik hijau yang menyerupai sisik naga.","Buah naga, yang juga dikenal sebagai pitaya atau dragon fruit, merupakan buah tropis yang tumbuh subur di Indonesia. Buah eksotis ini memiliki ciri khas berupa kulit merah tebal dengan sisik hijau yang menyerupai sisik naga. Daging buahnya bertekstur lembut dengan taburan biji hitam kecil dan tersedia dalam beberapa variasi warna: putih, kuning, merah muda, atau merah tua.
Kandungan Nutrisi
Buah naga menyimpan beragam nutrisi penting, termasuk:
Serat pangan tinggi
Antioksidan (betasianin, betaksantin)
Vitamin (B1, B2, B3, C, E)
Mineral (zat besi, kalsium, magnesium, fosfor, kalium, zinc)
Senyawa bioaktif (likopen, karotenoid)
Prebiotik alami
Manfaat Kesehatan
Mendukung Kesehatan Jantung
Menurunkan kadar kolesterol jahat (LDL) dan meningkatkan kolesterol baik (HDL)
Mengatur tekanan darah melalui kandungan magnesium dan kalium
Melindungi sel jantung dari kerusakan oksidatif
Meningkatkan fungsi endotel pembuluh darah
Membantu mengontrol kadar gula darah
Manfaat untuk Anak-anak
Mendukung tumbuh kembang optimal
Mencegah dehidrasi karena kandungan air tinggi
Meningkatkan daya tahan tubuh
Memelihara kesehatan tulang melalui kandungan kalsium
Menjaga kesehatan kulit dengan stimulasi pembentukan kolagen
Mencegah anemia berkat kandungan zat besi
Kesehatan Pencernaan
Mengatasi masalah sembelit
Menjaga kesehatan sistem pencernaan melalui kandungan prebiotik
Membantu metabolisme tubuh
Manfaat Spesifik
Buah naga memiliki peran penting dalam pencegahan berbagai kondisi kesehatan:
Mencegah aterosklerosis dan penyakit kardiovaskular
Mendukung pengaturan kadar gula darah pada penderita diabetes
Meningkatkan sistem kekebalan tubuh
Menjaga kesehatan sel dan jaringan tubuh
Membantu penyerapan zat besi
Rekomendasi Konsumsi
Buah naga dapat dikonsumsi oleh berbagai kelompok usia, dari bayi hingga dewasa. Teksturnya yang lembut dan rasa manis-asam yang menyegarkan membuatnya mudah diterima oleh semua kalangan. Untuk hasil optimal, konsumsi buah naga sebaiknya:
Menjadi bagian dari pola makan seimbang
Dikombinasikan dengan makanan bergizi lainnya
Dikonsumsi secara teratur
Meskipun penelitian tentang manfaat buah naga masih terus berkembang, bukti yang ada menunjukkan bahwa buah ini dapat menjadi pilihan tepat untuk mendukung kesehatan secara menyeluruh. Dengan kandungan nutrisi yang beragam dan manfaat kesehatan yang luas, buah naga layak menjadi bagian dari diet sehari-hari untuk mendukung gaya hidup sehat.
  Referensi
Kementerian Kesehatan Republik Indonesia. ""Buah Naga untuk Kesehatan Jantung: Manfaat dan Fakta Ilmiah."" Kemenkes RI. 2024
Kementerian Kesehatan Republik Indonesia. ""Buah Naga Atasi Sembelit pada Balita"" Kemenkes RI. 2023


Bagikan:
Download"
"Mengenal Vaksin HPV, Pencegahaan Kanker Serviks Sejak Dini",,https://www.biofarma.co.id/id/announcement/detail/mengenal-vaksin-hpv-pencegahaan-kanker-serviks-sejak-dini,"Rabu, 18 Desember 2024","Kanker serviks merupakan pembunuh terbesar kedua dan salah satu pemboros biaya kesehatan terbesar di Indonesia. Pada tahun 2021, terdapat 36.633 kasus kanker serviks di Indonesia.","Kanker serviks merupakan pembunuh terbesar kedua dan salah satu pemboros biaya kesehatan terbesar di Indonesia. Pada tahun 2021, terdapat 36.633 kasus kanker serviks di Indonesia. Namun, masih ada ruang untuk perbaikan dalam hal angka kematian. Sebagian besar kasus disebabkan oleh Human Papillomavirus, atau HPV. Kanker serviks dapat dicegah, meskipun merupakan penyakit dengan risiko kematian yang tinggi. Salah satu tindakan pencegahan yang paling penting adalah imunisasi HPV.
Pemerintah berupaya untuk membuat sistem kesehatan di Indonesia menjadi lebih kuat dan inovatif. Pemerintah ingin meningkatkan pelayanan kesehatan dengan lebih berfokus pada pencegahan dan promosi kesehatan. Hal ini termasuk memperkenalkan vaksin baru, seperti vaksin HPV, ke dalam program imunisasi nasional.
Mengenal Vaksinasi HPV
Vaksin HPV adalah berupa melindungi dari virus HPV, yang menyebabkan kanker serviks dan kanker lainnya. Vaksin ini menghentikan infeksi HPV dan menurunkan risiko kanker genital. Organisasi Kesehatan Dunia (WHO) menyatakan bahwa vaksinasi HPV harus dimasukkan ke dalam program imunisasi dasar untuk mencegah kanker serviks, yang merupakan salah satu kanker yang paling sering terjadi pada wanita.
Program imunisasi serviks sangat gencar diupayakan pemerintah Indonesia demi menekan angka pengidap kanker serviks di Indonesia. Mengingat Indonesia tercatat mengalami kematian terbesar akibat kanker serviks. Program ini diharapkan dapat menjadi program yang paling efektif dalam mengurangi beban penyakit dan melindungi generasi mendatang dari masalah kesehatan yang serius jika cakupannya luas. 
Target Usia Pemberian Vaksin HPV
WHO menyarankan pemberian vaksin HPV kepada anak perempuan mulai usia 9 tahun dengan jadwal dosis tertentu.
Anak dan Remaja
Satu atau dua dosis dalam selang waktu 6-12 bulan bagi anak usia 9-14 tahun
Satu atau dua dosis dalam selang waktu 6 bulan bagi remaja usia 15-20 tahun
Dewasa
Dua dosis dalam selang waktu 6 bulan bagi perempuan berusia di atas 21 tahun
Pemberian vaksin HPV tidak disarankan bagi perempuan berusia di atas 26 tahun. Pemberian vaksin HPV di saat usia jika lebih dari 26 tahun, khasiat dari vaksin tidak akan berjalan maksimal apabila sebelumnya sudah terpapar virus HPV.
Prosedur Pemberian Vaksin HPV
Prosedur pemberian vaksin HPV terdiri dari serangkaian langkah yang harus diikuti untuk menjamin keamanan dan kemanjuran vaksinasi. Langkah-langkah berikut ini biasanya dilakukan sebelum vaksinasi:
Konsultasi Awal : Sebelum menerima vaksin, pasien akan terlibat dalam sesi tanya jawab dengan dokter mengenai riwayat medis, alergi, dan gaya hidup mereka, termasuk aktivitas seksual. Hal ini sangat penting untuk mencegah potensi reaksi alergi terhadap vaksin.
Penjelasan Vaksin : Dokter akan menjelaskan kelebihan dan kekurangan vaksin HPV dan menjawab pertanyaan yang mungkin dimiliki pasien.
Berdasarkan beberapa penjelasan di atas, dapat disimpulkan bahwa penting nya untuk deteksi kanker serviks sejak dini dan mengajukan diri untuk mendapatkan vaksinasi HPV demi mewujudkan Wanita Indonesia terbebas dari kanker serviks. 
  Referensi: 
kemenkes.2024.Skrining Kanker Leher Rahim Dengan DNA HPV, Pegawai Kemenkes: Alhamdulillah Gratis
Kemenkes.2024.Vaksin HPV, Mencegah Kanker Leher Rahim Demi Mewujudkan Generasi Sehat
World Health Organization (WHO).2023.National Launch of Human Papillomavirus (HPV) Immunization Expansion
Kemenkes.2022.Wanita Beresiko Terkena Kanker Serviks
Bagikan:
Download"
