title,tag,link,date,description,content
5 Cara Merawat Ginjal agar Sehat & Cegah Penyakit Ginjal,,https://www.biofarma.co.id/id/announcement/detail/5-cara-merawat-ginjal-agar-sehat-cegah-penyakit-ginjal,"Rabu, 3 September 2025",Kenali cara merawat ginjal agar terhindar dari gejala ginjal bermasalah. Pelajari ciri penyakit ginjal dan pencegahan penyakit ginjal apa saja sejak dini.,"Ginjal adalah organ vital yang berfungsi menyaring darah, membuang limbah, dan menjaga keseimbangan cairan tubuh. Jika tidak dijaga, fungsi ginjal bisa menurun dan menimbulkan masalah serius. Banyak penyakit ginjal apa saja yang berkembang tanpa gejala pada tahap awal, sehingga penting menjaga kesehatan ginjal sejak dini.
Berikut ini adalah 5 cara merawat ginjal yang sederhana namun efektif untuk mencegah gejala ginjal bermasalah:
1. Minum Air Putih yang Cukup
Asupan cairan yang cukup membantu ginjal bekerja optimal dalam membuang racun dan sisa metabolisme. Kurang minum air bisa menyebabkan dehidrasi dan meningkatkan risiko batu ginjal. Biasakan minum 8–10 gelas air putih setiap hari untuk menjaga fungsi ginjal tetap sehat.
2. Batasi Konsumsi Garam
Asupan garam berlebih dapat meningkatkan tekanan darah. Tekanan darah tinggi merupakan salah satu faktor utama penyebab penyakit ginjal kronis. Mengurangi makanan asin seperti mie instan dan makanan olahan membantu menjaga aliran darah ke ginjal tetap lancar.
3. Jaga Kadar Gula Darah
Kadar gula darah tinggi tidak hanya menyebabkan diabetes, tetapi juga bisa merusak pembuluh darah kecil di ginjal. Kondisi ini dapat memicu ciri penyakit ginjal seperti bengkak atau adanya protein dalam urine. Konsumsi makanan tinggi serat, kurangi gula tambahan, dan lakukan aktivitas fisik rutin untuk menjaga gula darah tetap stabil.
4. Hindari Konsumsi Alkohol Berlebihan
Konsumsi alkohol berlebih mengganggu keseimbangan cairan dan elektrolit dalam tubuh. Alkohol juga dapat memperburuk tekanan darah tinggi yang berdampak pada kesehatan ginjal. Batasi konsumsi alkohol, atau sebaiknya hindari sama sekali, agar ginjal tetap berfungsi optimal.
5. Hentikan Kebiasaan Merokok
Rokok mengandung zat kimia yang merusak pembuluh darah, termasuk aliran darah ke ginjal. Hal ini membuat ginjal tidak mendapat suplai darah yang cukup untuk bekerja dengan baik. Menghentikan kebiasaan merokok, termasuk vape, akan membantu mencegah munculnya gejala ginjal bermasalah.
Jika Biotizen mengalami gejala ginjal seperti nyeri saat buang air kecil, urine berbusa atau bercampur darah, atau pembengkakan di tubuh, segera lakukan pemeriksaan medis. Deteksi dini sangat penting karena banyak penyakit ginjal tidak menimbulkan gejala jelas pada awalnya.
  Referensi
Kementerian Kesehatan RI. 2021. Hidup Berkualitas dengan Mencegah dan Mengendalikan Penyakit Ginjal.
Kementerian Kesehatan RI. 2024. Mengenal Gagal Ginjal, Sebuah Panduan untuk Hidup Sehat.
National Kidney Foundation. Alcohol and Your Kidneys.
National Kidney Foundation. Healthy Hydration and Your Kidneys.
National Kidney Foundation. High Blood Pressure and Chronic Kidney Disease.
Bagikan:
Download"
7 Tips Untuk Menjaga Kesehatan Mata,,https://www.biofarma.co.id/id/announcement/detail/7-tips-untuk-menjaga-kesehatan-mata,"Jumat, 29 Agustus 2025","Tips menjaga kesehatan mata: nutrisi bergizi, kacamata pelindung, olahraga, hingga periksa rutin ke dokter","Menjaga kesehatan mata sangatlah penting karena mata berperan besar dalam hampir semua aktivitas sehari-hari, mulai dari belajar, bekerja, hingga berinteraksi dengan lingkungan sekitar. Jika kesehatan mata terabaikan, berbagai masalah bisa muncul, mulai dari iritasi ringan, infeksi, hingga penyakit serius yang berisiko menyebabkan kebutaan. Untuk itu, menjaga mata dapat dilakukan melalui pemeriksaan rutin ke dokter dan juga dengan membiasakan pola hidup sehat yang mendukung fungsi penglihatan tetap optimal.
Seiring bertambahnya usia atau karena kebiasaan sehari-hari yang kurang sehat, fungsi mata bisa menurun. Namun, hal ini bukan berarti tidak bisa dicegah. Dengan langkah sederhana, seperti menjaga asupan nutrisi, memberi waktu istirahat saat menatap layar, serta melindungi mata dari paparan sinar berlebih, Anda tetap bisa menjaga kualitas penglihatan agar bertahan lebih lama.
Tips Menjaga Kesehatan Mata
Mata termasuk salah satu organ yang paling aktif digunakan setiap hari. Agar penglihatan tetap tajam dan terhindar dari gangguan, ada beberapa langkah sederhana yang bisa diterapkan dalam rutinitas sehari-hari:
Rutin memeriksakan mata
Baik anak-anak maupun orang dewasa dianjurkan melakukan pemeriksaan mata secara teratur, minimal setiap 2 tahun sekali. Untuk usia 40 tahun, lebih baik dilakukan setiap tahun. Pemeriksaan ini penting agar gangguan mata seperti glaukoma, katarak, atau degenerasi makula bisa dideteksi lebih awal. Selain itu, dokter dapat melihat kondisi mata yang mungkin terpengaruh oleh penyakit lain, misalnya diabetes atau tekanan darah tinggi. Jika ada riwayat penyakit mata dalam keluarga, pemeriksaan rutin akan membantu penanganan lebih cepat dan tepat.
Penuhi kebutuhan nutrisi
Asupan makanan yang kaya vitamin A, C, E, lutein, selenium dan omega-3 sangat bermanfaat untuk menjaga penglihatan. Nutrisi tersebut dapat mengurangi resiko penyakit mata yang berhubungan dengan penuaan, seperti katarak dan degenerasi makula. Sumbernya bisa didapat dari sayuran berdaun hijau, ikan, telur, kacang-kacangan, dan buah jeruk untuk tetap menjaga penglihatan.
Batasi waktu menatap layar
Terlalu lama berada di depan komputer atau handphone bisa membuat mata cepat lelah, kering, bahkan pandangan menjadi buram.Gejala yang biasa terjadi berupa nyeri leher, sakit kepala, mata kering, nyeri bahu dan punggung serta pandangan menjadi kabur. Untuk mencegahnya, gunakan aturan 20-20-20: setiap 20 menit, alihkan pandangan ke objek sejauh 20 meter selama 20 detik. Selain itu, istirahatlah sekitar 15 menit setiap 2 jam.Jika mata terasa kering, cobalah lebih sering mengedipkan mata atau menggunakan tetes mata pelembab juga bisa membantu mengurangi rasa kering.
Lindungi mata dari paparan sinar ultraviolet
Paparan sinar matahari yang berlebihan tidak hanya merusak kulit, tetapi juga berbahaya bagi mata. Kondisi seperti katarak, degenerasi makula, hingga kanker mata bisa dipicu oleh sinar UV. Karena itu, gunakan kacamata hitam dengan pelindung UVA dan UVB atau kenakan topi bertepi lebar saat beraktivitas di luar ruangan. Bagi yang sering bekerja di depan komputer, kacamata antiradiasi juga dapat membantu mengurangi ketegangan mata.
Jauhi rokok untuk kesehatan mata
Merokok terbukti meningkatkan risiko terjadinya katarak, degenerasi makula, serta kerusakan saraf optik yang bisa berujung pada kebutaan. Mengurangi atau menghentikan kebiasaan merokok akan sangat bermanfaat, tidak hanya untuk kesehatan mata tetapi juga kesehatan tubuh secara keseluruhan.
Perhatikan kebersihan make up yang digunakan
Produk make up berbentuk cair atau krim bisa menjadi tempat berkembangnya bakteri bila tidak digunakan dengan benar. Gunakan kuas yang selalu bersih, hindari berbagi alat rias dengan orang lain, dan segera buang produk yang berubah warna, bau, atau teksturnya. Jangan lupa cuci wajah dengan bersih sebelum dan sesudah menggunakan make up. Jika mata terasa iritasi setelah menggunakan riasan, segera hentikan pemakaian dan periksakan ke dokter.
Lakukan olahraga secara teratur
Aktivitas fisik terbukti membantu menjaga kesehatan mata. Olahraga teratur dapat menurunkan risiko berbagai penyakit, termasuk tekanan darah tinggi, diabetes, dan kolesterol tinggi, yang semuanya bisa mempengaruhi kondisi mata. Luangkan waktu setidaknya 30 menit sehari untuk berolahraga agar tubuh dan mata tetap sehat.
Kalau mata mulai menunjukkan tanda-tanda iritasi seperti terasa perih, gatal, memerah, atau penglihatan menjadi kabur, sebaiknya jangan diabaikan. Langkah sederhana seperti menggunakan tetes mata atau mengompres dingin mungkin bisa membantu, tapi jika keluhan tidak juga membaik, segera periksakan diri ke dokter mata. Dengan pemeriksaan yang tepat, penyebab gangguan bisa diketahui sejak dini sehingga penanganan dapat dilakukan lebih cepat dan mencegah masalah yang lebih serius.
  Referensi:
National Eye Institute. Diakses pada 2020. Keep Your Eyes Healthy.
Harvard Health Publishing (2020). Diseases & Conditions. Warning Signs of a Serious Eye Problem.
Belden, M. E. All About Vision (2020). Has UV Exposure been Linked to Eye Cancer?
WebMD (2022). How to Keep Your Eyes Healthy.
Bagikan:
Download"
Jangan Sepelekan! 10 Penyebab Campak yang Sering Terabaikan,,https://www.biofarma.co.id/id/announcement/detail/jangan-sepelekan-10-penyebab-campak-yang-sering-terabaikan,"Kamis, 28 Agustus 2025","Kenali faktor utama penyebab campak, gejala khasnya, dan cara pencegahan melalui imunisasi MMR","Penyebab Campak
Campak adalah penyakit menular yang disebabkan oleh virus Morbili dan dapat menyebar dengan sangat cepat dari satu orang ke orang lain. Mekanisme utama penularannya adalah melalui percikan air liur (droplet) yang keluar dari mulut atau hidung penderita saat batuk, bersin, atau berbicara. Selain itu, seseorang juga dapat tertular jika menyentuh benda yang sudah terkontaminasi virus lalu menyentuh hidung, mulut, atau mata. Berikut adalah sepuluh faktor penyebab yang paling berpengaruh:
Belum Mendapatkan Vaksinasi Campak atau MMR
Campak sebagian besar menyerang individu yang belum divaksin. Vaksin MMR (Measles, Mumps, Rubella) terbukti sangat efektif dalam mencegah penyakit ini. Anak-anak yang tidak menerima vaksin secara lengkap memiliki risiko jauh lebih tinggi untuk terinfeksi karena tidak memiliki kekebalan tubuh yang cukup terhadap virus Morbili Virus.
Usia Bayi yang Masih Terlalu Muda untuk Divaksinasi
Bayi di bawah usia 9 bulan biasanya belum mendapatkan vaksin campak karena sistem imunnya masih berkembang. Hal ini membuat mereka sangat rentan tertular jika berada di lingkungan dengan penderita campak. 
Kontak Dekat dengan Penderita Campak
Seseorang yang tinggal serumah atau merawat pasien campak berisiko tinggi tertular karena paparan virus sangat intens. Virus campak dapat bertahan di udara selama 2 jam setelah penderita batuk atau bersin, sehingga orang di sekitar dapat terinfeksi tanpa harus melakukan kontak fisik langsung.
Sistem Kekebalan Tubuh yang Lemah
Orang dengan daya tahan tubuh rendah, seperti penderita HIV/AIDS, kanker, atau mereka yang sedang menjalani terapi imunosupresif, memiliki kerentanan lebih tinggi. Tubuh mereka tidak mampu melawan serangan virus dengan efektif sehingga infeksi campak dapat berkembang lebih cepat dan lebih parah.
Kekurangan Nutrisi, Terutama Vitamin A
Malnutrisi merupakan faktor penting dalam meningkatnya risiko campak. Kekurangan vitamin A, misalnya, dapat melemahkan sistem imun sekaligus memperburuk gejala ketika terinfeksi. Anak-anak dengan gizi buruk cenderung mengalami komplikasi lebih serius, seperti diare parah, pneumonia, atau bahkan kebutaan akibat infeksi campak.
Lingkungan Padat Penduduk dan Kurang Sehat
Tinggal di wilayah padat dengan sanitasi buruk mempermudah penyebaran virus. Kondisi ini sering terjadi di daerah perkotaan atau permukiman dengan akses kesehatan terbatas. Virus campak sangat menular, sehingga satu orang sakit dapat dengan cepat menularkan ke banyak orang di sekitarnya.
Perjalanan ke Daerah Endemis atau Negara dengan Cakupan Vaksinasi Rendah
Orang yang bepergian ke negara-negara dengan angka vaksinasi rendah atau sedang mengalami wabah campak berisiko tinggi tertular. Virus dapat dengan mudah terbawa dari satu negara ke negara lain, sehingga WHO menekankan pentingnya vaksinasi sebelum melakukan perjalanan internasional.
Riwayat Keluarga yang Tidak Mendapatkan Vaksinasi
Jika dalam satu keluarga tidak ada riwayat vaksinasi, risiko penularan dalam rumah tangga menjadi sangat tinggi. Virus campak biasanya menyebar cepat antar anggota keluarga karena interaksi intens sehari-hari dan kedekatan jarak tinggal.
Kurangnya Kesadaran akan Kebersihan Diri
Perilaku tidak menjaga kebersihan, seperti jarang mencuci tangan setelah bersin atau setelah memegang benda umum, meningkatkan kemungkinan penularan. Virus Morbili Virus bisa bertahan di permukaan benda, sehingga menyentuh wajah setelah kontak dengan permukaan terkontaminasi dapat menjadi pintu masuk infeksi.
Stres dan Kondisi Fisik yang Melemah
Faktor psikologis seperti stres berkepanjangan, kelelahan, atau kurang tidur dapat menurunkan sistem imun tubuh. Kondisi ini membuat seseorang lebih rentan terinfeksi jika terpapar virus campak. Meskipun bukan penyebab utama, faktor ini berperan dalam memperburuk daya tahan tubuh terhadap penyakit menular.
Campak bisa dicegah dengan langkah sederhana namun sangat penting, yaitu imunisasi. Pastikan Anda dan keluarga sudah mendapatkan imunisasi campak sesuai jadwal. Bila muncul gejala seperti demam tinggi, batuk, mata merah, atau ruam, segera periksakan diri ke dokter agar penanganan bisa dilakukan sejak dini.

Referensi : 
World Health Organization. (2024). Measles fact sheet. 
Kementerian Kesehatan Republik Indonesia. (2025). Campak. AyoSehat – Kementerian Kesehatan RI. 
Centers for Disease Control and Prevention. (2024). Measles (Rubeola): About measles.
Bagikan:
Download"
"Campak - Penyebab, Gejala, dan Pencegahannya",,https://www.biofarma.co.id/id/announcement/detail/campak-penyebab-gejala-dan-pencegahannya,"Senin, 25 Agustus 2025",Campak bisa berbahaya bila dibiarkan. Periksa ke dokter sejak gejala awal muncul agar penanganan lebih tepat.,"Apa itu campak?
Campak atau rubella adalah penyakit menular yang disebabkan oleh virus dari keluarga Paramyxoviridae dengan genus Morbillivirus. Penyakit ini menyerang saluran pernapasan terlebih dahulu, lalu menimbulkan gejala sistemik seperti demam, batuk, pilek, sakit tenggorokan, mata merah, hingga ruam menyeluruh di kulit. Campak termasuk penyakit yang sangat menular, bisa berpindah dari orang ke orang hanya melalui udara, percikan air liur, atau benda yang terkontaminasi virus.
Apa saja gejala campak?
Gejala campak biasanya muncul setelah masa inkubasi 7–14 hari. Gejala awal mirip flu, seperti demam, lemas, batuk kering, pilek, sakit tenggorokan, diare, muntah, serta mata merah dan berair yang sensitif terhadap cahaya. Bercak putih kecil (bintik Koplik) sering muncul di dalam mulut. Beberapa hari kemudian, ruam kemerahan muncul mulai dari wajah dan leher, lalu menyebar ke seluruh tubuh. Ruam biasanya bertahan 5–7 hari, dengan suhu tubuh bisa mencapai 39–40°C.
Apa penyebab campak?
Campak disebabkan oleh infeksi virus Morbili Virus. Virus ini sangat mudah menular melalui:
Percikan liur (droplet): keluar saat batuk, bersin, atau berbicara.
Udara: virus dapat bertahan hingga 2 jam di ruangan tertutup dengan sirkulasi buruk.
Kontak langsung: seperti berciuman atau merawat penderita.
Benda terkontaminasi: sendok, gagang pintu, saklar, dan barang yang disentuh bersama.
Penularan bisa terjadi sejak gejala awal (demam, batuk, pilek) hingga 4 hari setelah ruam muncul.
Apa saja yang tidak boleh dilakukan saat sakit campak?
Ketika sakit campak, ada beberapa hal yang sebaiknya dihindari:
Jangan berbagi peralatan makan, minum, atau perlengkapan pribadi (sikat gigi, lip balm, handuk).
Jangan melakukan kontak dekat dengan bayi, anak kecil, ibu hamil, atau orang dengan daya tahan tubuh lemah karena mereka lebih rentan komplikasi.
Jangan beraktivitas di keramaian atau bepergian tanpa masker karena bisa menularkan lewat udara.
Jangan mengabaikan gejala serius (demam tinggi >39°C, sesak napas, kejang, linglung), karena kondisi ini butuh penanganan medis segera.
Apa yang harus dilakukan untuk mencegah campak?
Beberapa langkah pencegahan yang disarankan:
Imunisasi campak: menjadi cara utama untuk melindungi diri dari infeksi.
Gunakan masker: terutama saat berada di kerumunan.
Cuci tangan rutin: dengan sabun atau hand sanitizer sebelum menyentuh wajah.
Isolasi mandiri: bila sudah terinfeksi, lakukan isolasi sejak gejala awal hingga 4 hari setelah ruam muncul.
Hindari berbagi barang pribadi: seperti alat makan atau kosmetik.
Jaga kebersihan lingkungan: rutin membersihkan barang yang sering disentuh dengan disinfektan.
Kapan imunisasi campak diberikan?
Jadwal imunisasi campak dan MMR sebagai berikut:
Bayi usia 9 bulan mendapatkan imunisasi campak.
Imunisasi campak diberikan ulang pada usia 12–18 bulan, lalu diulang lagi saat usia 5–7 tahun.
Orang dewasa yang belum pernah divaksin tetap bisa mendapat imunisasi campak dengan 2 dosis (jarak 28 hari antar dosis).
Wanita yang berencana hamil dianjurkan imunisasi minimal 1 bulan sebelum kehamilan, karena imunisasi campak tidak boleh diberikan saat sedang hamil.
Kalau kamu atau orang terdekat mulai merasakan gejala campak seperti demam tinggi, batuk, pilek, mata merah, atau muncul ruam di kulit, sebaiknya jangan menunda pengobatan. Campak bisa menimbulkan komplikasi serius bila tidak ditangani dengan tepat. Segera cek ke dokter atau fasilitas kesehatan terdekat agar mendapatkan diagnosis dan perawatan yang sesuai, sehingga proses penyembuhan lebih cepat dan risiko penularan bisa dicegah. 
  Referensi: 
World Health Organization (2024). Measles.
Centers for Disease Control and Prevention. Measles (Rubeola). Diakses pada 2021.
Centers for Disease Control and Prevention (2024). Measles (Rubeola). 
Mayo Clinic (2025). Measles.
Bagikan:
Download"
Cara Mudah Menjaga Kesehatan Gigi dan Mulut agar Terhindar dari Penyakit,,https://www.biofarma.co.id/id/announcement/detail/cara-mudah-menjaga-kesehatan-gigi-dan-mulut-agar-terhindar-dari-penyakit,"Rabu, 20 Agustus 2025","Kesehatan gigi dan mulut adalah kondisi ketika gigi, gusi, lidah, dan seluruh rongga mulut terjaga kebersihan serta fungsinya dengan baik. Mulut merupakan gerbang utama bagi makanan dan minuman yang masuk ke dalam tubuh, sekaligus organ yang berperan...","Apa itu Kesehatan Gigi dan Mulut?
Kesehatan gigi dan mulut adalah kondisi ketika gigi, gusi, lidah, dan seluruh rongga mulut terjaga kebersihan serta fungsinya dengan baik. Mulut merupakan gerbang utama bagi makanan dan minuman yang masuk ke dalam tubuh, sekaligus organ yang berperan penting dalam proses pencernaan. Saat makanan masuk, sebagian akan tertinggal dalam mulut. Jika tidak dibersihkan, sisa tersebut bisa menjadi tempat berkembangnya bakteri. Oleh karena itu, kesehatan mulut tidak hanya berkaitan dengan keindahan senyum atau napas segar saja, tetapi juga sangat menentukan kesehatan tubuh secara menyeluruh.
Akibat Tidak Menjaga Kesehatan Gigi dan Mulut
Mengabaikan kebersihan mulut dan gigi dapat memicu berbagai gangguan kesehatan. Masalah yang sering muncul di antaranya:
Bau Mulut (halitosis), terjadi karena sisa makanan membusuk di dalam mulut atau akibat kebiasaan merokok.
Gigi Berlubang, akibat menumpuknya plak yang mengikis email gigi.
Radang Gusi (gingivitis), bila tidak diatasi bisa berkembang menjadi periodontitis yang membuat gigi goyah hingga tanggal.
Abses Gigi, infeksi serius yang menyebabkan penumpukan nanah di gigi atau gusi.
Karang Gigi, penumpukan plak yang mengeras, sulit dibersihkan tanpa bantuan dokter.
Dalam kasus yang lebih serius, kondisi ini bisa meningkatkan risiko penyakit kronis, seperti diabetes, penyakit jantung, hingga infeksi berbahaya yang menyebar ke seluruh tubuh.
Cara Menjaga Kesehatan Gigi dan Mulut
Perawatan gigi dan mulut sebaiknya dilakukan setiap hari secara konsisten. Beberapa langkah yang bisa diterapkan antara lain:
Menyikat gigi dengan benar minimal dua kali sehari, terutama setelah sarapan dan sebelum tidur. Gunakan pasta gigi berfluoride agar gigi lebih kuat.
Flossing atau membersihkan sela gigi dengan benang gigi untuk mengangkat kotoran yang tidak bisa dijangkau sikat.
Menggunakan obat kumur untuk membunuh bakteri penyebab bau mulut dan plak.
Mengurangi makanan manis dan asam karena bisa mempercepat kerusakan gigi.
Menghentikan kebiasaan merokok dan mengkonsumsi alkohol, karena zat di dalamnya dapat merusak gigi, gusi, dan meningkatkan risiko kanker mulut.
Rutin periksa ke dokter gigi minimal setiap enam bulan sekali untuk deteksi dini masalah gigi.
Mengganti sikat gigi secara berkala, sekitar setiap tiga bulan, agar fungsinya tetap optimal.
Menjaga kesehatan mulut dan gigi bukan sekadar kebiasaan kecil, tetapi investasi besar untuk kesehatan jangka panjang. Mulut yang sehat akan mempermudah proses makan, berbicara, dan menunjang penampilan. Lebih dari itu, menjaga kebersihan gigi dapat menurunkan risiko penyakit serius yang berhubungan dengan organ lain, seperti jantung, paru-paru, hingga ginjal.
Kebiasaan sederhana seperti menyikat gigi dengan benar, flossing, dan pemeriksaan rutin bisa memberi dampak besar. Dengan mulut dan gigi yang sehat, seseorang akan lebih percaya diri, tubuh lebih terlindungi dari berbagai penyakit, dan kualitas hidup pun meningkat.
Kapan Sebaiknya Memeriksakan Gigi dan Mulut ke Dokter
Jika Anda mengalami keluhan gigi berlubang, gigi retak, atau bau mulut yang tidak hilang meski sudah dibersihkan, segera konsultasikan dengan dokter gigi. Pemeriksaan sejak dini menjaga kesehatan mulut dan gigi serta mencegah risiko penyakit yang lebih serius.
  Referensi:
Family Doctor. 2022. Mouth and Teeth: How to Keep Them Healthy.
National Health Service UK. 2022. Take care of your teeth and gums.
Kemenkes. 2024. Jaga Kesehatan Tubuh dengan Menjaga Kesahatan Gigi dan Mulut
Bagikan:
Download"
"Cedera Otot Saat Olahraga: Gejala, Penyebab, dan Cara Mengatasinya",,https://www.biofarma.co.id/id/announcement/detail/cedera-otot-saat-olahraga-gejala-penyebab-dan-cara-mengatasinya,"Rabu, 20 Agustus 2025","Cedera olahraga adalah gangguan pada otot, sendi, atau jaringan tubuh yang terjadi saat melakukan aktivitas fisik. Cedera ini bisa muncul akibat gerakan yang salah, benturan dengan orang lain, penggunaan peralatan yang tidak sesuai, atau karena tubuh...","Jelaskan apa yang dimaksud dengan cedera olahraga
Cedera olahraga adalah gangguan pada otot, sendi, atau jaringan tubuh yang terjadi saat melakukan aktivitas fisik. Cedera ini bisa muncul akibat gerakan yang salah, benturan dengan orang lain, penggunaan peralatan yang tidak sesuai, atau karena tubuh dipaksa bekerja melebihi kemampuannya. Bentuk cedera yang umum antara lain kram, keseleo, cedera lutut, hamstring, hingga cedera pinggang bawah.
Apa yang perlu dilakukan untuk menghindari cedera otot saat olahraga
Untuk mencegah cedera, ada beberapa langkah yang bisa dilakukan, seperti menjaga kebugaran tubuh, melakukan pemanasan sebelum berolahraga, pendinginan setelahnya, serta menjaga tubuh tetap terhidrasi. Selain itu, penggunaan perlengkapan olahraga yang tepat dan istirahat yang cukup juga membantu otot tetap fleksibel dan terhindar dari ketegangan.
Apa yang menyebabkan cedera otot
Cedera otot bisa terjadi karena berbagai hal, seperti kurang pemanasan, gerakan atau teknik olahraga yang salah, tubuh yang terlalu lelah, serta dehidrasi. Selain itu, terlalu sering berolahraga tanpa memberi jeda istirahat, benturan langsung, maupun postur tubuh yang keliru saat beraktivitas juga menjadi penyebab umum terjadinya cedera.
Jelaskan cara penanganan cedera kram otot
Saat mengalami kram otot, langkah pertama adalah berhenti beraktivitas dan mengistirahatkan bagian tubuh yang sakit. Lakukan peregangan perlahan pada otot yang kram, kemudian kompres dengan es untuk mengurangi nyeri. Pijat ringan juga bisa membantu memperlancar aliran darah. Selain itu, pastikan tubuh cukup cairan karena kram sering muncul akibat dehidrasi.
Berapa lama penyembuhan cedera otot
Lama penyembuhan cedera otot tergantung tingkat keparahannya. Cedera ringan biasanya pulih dalam beberapa hari hingga dua minggu. Untuk cedera sedang, pemulihan bisa memakan waktu tiga sampai enam minggu. Sedangkan cedera berat, seperti robekan otot, dapat memerlukan waktu berbulan-bulan serta terapi khusus agar fungsi otot bisa kembali normal.
Untuk menghindari terjadi cedera otot sebelum latihan diperlukan
Sebelum memulai latihan, tubuh perlu dipersiapkan dengan baik. Pemanasan menjadi langkah penting karena membantu meningkatkan aliran darah ke otot dan membuat tubuh lebih siap bergerak. Peregangan, jogging ringan, atau gerakan mobilitas sendi bisa dilakukan sebagai persiapan. Selain itu, pastikan kondisi tubuh fit, gunakan peralatan yang sesuai, minum air yang cukup, dan jangan memaksakan diri ketika tubuh sudah lelah.
Cedera otot saat olahraga bisa terjadi kapan saja, terutama jika tubuh tidak dipersiapkan dengan baik. Mulai dari pemanasan, hidrasi, hingga penggunaan peralatan yang tepat, semua langkah tersebut penting untuk menurunkan risiko cedera. Namun, jika kamu sudah mengalami cedera otot atau merasakan gejala seperti nyeri hebat, bengkak, atau sulit bergerak, jangan menunda untuk mendapatkan penanganan medis.
Segera konsultasikan kondisi kamu dengan dokter agar mendapatkan diagnosis yang tepat dan saran perawatan terbaik. Dengan begitu, proses penyembuhan cedera otot bisa lebih cepat dan aman, sehingga kamu bisa kembali berolahraga tanpa khawatir cedera kambuh.
  Referensi:
KEMENKES. 2018. Tips Bebas Cedera saat Berolahraga
Orthoinfo. Diakses pada 2022. Soccer Injury Prevention.
Better Health Channel. Diakses pada 2022. Soccer – preventing injury.
Bagikan:
Download"
