title;tag;link;date;description;content
Kepala BPOM Taruna Ikrar Sebut Akan Berantas Produk Ilegal;;https://health.detik.com/berita-detikhealth/d-8112763/kepala-bpom-taruna-ikrar-sebut-akan-berantas-produk-ilegal;Senin, 15 Sep 2025 13:35;Badan Pengawas Obat dan Makanan (BPOM RI) mengatakan bahwa peredaran produk kesehatan palsu atau ilegal di negara berkembang angkanya masih mengkhawatirkan.;"Badan Pengawas Obat dan Makanan (BPOM RI) mengatakan bahwa peredaran produk kesehatan palsu atau ilegal di negara berkembang angkanya masih mengkhawatirkan. Setidaknya, 1 dari 10 produk seperti obat, kosmetik, hingga bahan pangan termasuk tidak berizin. Hal ini disampaikan Kepala BPOM Taruna Ikrar di Jakarta Pusat, Senin (15/9/2025), mengutip data organisasi kesehatan dunia (WHO). Menurut data tersebut, satu dari 10 produk kesehatan di negara berkembang disebutnya memiliki mutu rendah. ""Kalau bukan palsu, ya ilegal, juga kualitasnya rendah, kan banyak sekali,"" kata Ikrar. ADVERTISEMENT SCROLL TO CONTINUE WITH CONTENT Sebagai upaya memberantas produk ilegal, Ikrar menyebut BPOM bersama Kementerian Komunikasi dan Digital (Komdigi) pada 2024 telah men-take down atau menurunkan sebanyak 309 ribu tautan yang tidak memenuhi syarat di e-commerce.  ""Jadi kalau satu produk saja satu tautan, itu kira-kira dipakai oleh berapa ratus orang? Ini 309 ribu tautan,"" tegasnya. Dampak dari maraknya produk kesehatan ilegal atau tidak berizin tersebut, BPOM setiap tahunnya menguak ratusan perkara. ""Untuk perkara pada tahun 2022, itu ada 262 perkara. Pada tahun 2023, itu 263 perkara, tahun 2024 282 perkara. Dan tahun ini saja sudah ratusan perkara,"" kata Ikrar. ""Maknanya apa? Kejahatan tidak semakin turun, kejahatan semakin meningkat tiap tahunnya. Apakah BPOM atau lembaga terkait tidak bekerja? Bukan kami tidak bekerja, tapi kami membuktikan bahwa kami kerja keras, sehingga perkara itu kami tangkap,"" sambungnya. Ikrar menegaskan bahwa ke depannya, BPOM RI di bawah kepemimpinannya tidak akan bekerja seperti 'pemadam kebakaran', yakni menunggu adanya kasus atau masalah baru ditindak. ""Ini dampaknya besar sekali, bukan hanya kesehatan, keselamatan jiwa, tapi dampaknya adalah termasuk ekonomi nasional kita,"" tutupnya. "
8 Tanda Tubuh Kekurangan Vitamin D, Salah Satunya Cemas;;https://health.detik.com/berita-detikhealth/d-8112653/8-tanda-tubuh-kekurangan-vitamin-d-salah-satunya-cemas;Senin, 15 Sep 2025 13:00;Vitamin D merupakan salah satu nutrisi yang dibutuhkan oleh tubuh.;"Vitamin D merupakan salah satu nutrisi yang dibutuhkan oleh tubuh. Perannya begitu penting dalam menjaga kesembangan kalsium dalam darah dan tulang. Terlebih, tubuh membutuhkan vitamin D agar bisa menggunakan kalsium dan fosfor untuk membangun tulang dan mendukung jaringan sehat. Kekurangan vitamin D tentunya bisa menyebabkan masalah, terutama pada tulang dan otot. Apa saja beberapa tanda tubuh kekurangan vitamin D? Tanda-tanda tubuh kekurangan vitamin D di antaranya kelelahan, nyeri otot, dan merasa cemas. Ketahui informasi lebih jelasnya berikut ini. ADVERTISEMENT SCROLL TO CONTINUE WITH CONTENT Kelelahan wajar dirasakan. Namun, jika kondisi ini tidak kunjung hilang meski sudah istirahat cukup, kadar vitamin D yang rendah bisa jadi penyebabnya. Dikutip dari laman Endocrine Center, vitamin D membantu sel-sel memproduksi energi. Ketika kadarnya rendah, maka kelelahan bisa muncul dan menguras tenaga. Vitamin C membantu tubuh menyerap kalsium dan mengatur kontraksi otot. Kekurangan vitamin ini bisa menyebabkan nyeri otot, penurunan kekuatan, atau kram. Jadi, jika merasakan ketidaknyamanan otot yang terus menerus tanpa tahu alasannya, kemungkinan kekurangan vitamin D yang menjadi penyebabnya. Kekurangan vitamin D juga bisa merusak sistem kekebalan tubuh dan kemampuan tubuh dalam melawan infeksi, seperti flu dan lainnya. Sehingga, penting untuk mencukupi kebutuhan vitamin D. Vitamin D membantu tubuh menyerap kalsium, sehingga nutrisi ini penting untuk kesehatan tulang. Tanpa vitamin D yang cukup, kepadatan tulang bisa menurun dan menyebabkan kondisi yang disebut sebagai osteomalasia. Dikutip dari laman Cleveland Clinic, osteomalasia adalah kondisi tulang yang melunak dan melemah, sehingga menyebabkannya lebih mudah patah. Kekurangan vitamin D dikaitkan dengan kecemasan dan depresi, terutama pada orang dewasa yang lebih tua. Akan tetapi, beberapa hasil penelitian bertentangan dan diperlukan lebih banyak penelitian. Vitamin D sendiri sering dijuluki sebagai ""vitamin sinar matahari"" karena membuat tubuh merasa ""cerah"" dengan meningkatkan kadar serotonin di otak. Kesulitan menurunkan berat badan, padahal sudah menjalani gaya hidup aktif dan pola makan sehat? Mungkin salah satu penyebabnya adalah kekurangan kadar vitamin D. Menurut studi, ada hubungan antara kekurangan vitamin D dan kenaikan berat badan. Namun hubungan pastinya masih dalam tahap penelitian. Tanda dari kekurangan vitamin D lainnya adalah waktu yang lama dalam penyembuhan luka atau lecet di kulit. Vitamin D membantu memproduksi senyawa penting untuk pembentukan sel kulit baru. Luka yang lambat sembuh bisa jadi merupakan tanda dari kurangnya vitamin D yang memengaruhi proses pemulihan alami tubuh. Kalsium membuat tulang dan gigi kuat. Kekurangan vitamin D yang menghambat penyerapan kalsium bisa melemahkan gigi, meningkatkan risiko gigi berlubang dan kerusakan gigi. Dikutip dari laman Yale Medicine, biasanya mengonsumsi lebih banyak makanan kaya vitamin D tidak cukup untuk memperbaiki kekurangan vitamin D, sehingga dokter mungkin akan menyarankan untuk mengonsumsi suplemen. Dosisnya bisa bervariasi, tergantung pada tingkat keparahan, usia, berat badan, dan apakah orang yang mengonsumsinya sedang hamil atau menyusui. Penting pula untuk memastikan telah mengonsumsi kalsium yang cukup. Dokter mungkin juga menganjurkan untuk mengonsumsi makanan yang kaya vitamin D seperti: Ditinjau oleh:Mhd. Alrdian, S.Gz, lulusan ilmu gizi Universitas Andalas, saat ini menjadi penulis lepas di detikcom."
Klinik IVF dengan Harga Terjangkau Kini Ada di Bandung;;https://health.detik.com/berita-detikhealth/d-8112544/klinik-ivf-dengan-harga-terjangkau-kini-ada-di-bandung;Senin, 15 Sep 2025 12:31;Bayi tabung atau In Vitro Fertilization (IVF) adalah program kehamilan dengan metode pembuahan sel telur oleh sperma yang dilakukan di laboratorium.;"Bayi tabung atau In Vitro Fertilization (IVF) adalah program kehamilan dengan metode pembuahan sel telur oleh sperma yang dilakukan di laboratorium. Metode ini bisa menjadi pilihan bagi pasangan yang kesulitan untuk memiliki momongan, karena masalah infertilitas yang tidak lagi bisa ditangani oleh pengobatan dan terapi konvensional. Kendati demikian, biaya bayi tabung terbilang mahal, yaitu berkisar antara Rp 60- Rp 100 juta per siklus untuk prosedurnya saja. Harga tersebut belum termasuk obat-obatan dan lain sebagainya. Sehingga, upaya menghadirkan layanan bayi tabung atau IVF yang lebih terjangkau begitu penting. Dokter obgyn Hanoum Husni Syam, SpOG, Subsp. Fer yang juga merupakan founder Rumah Sakit Ibu dan Anak Grha Bunda, Kota Bandung mengungkapkan, jumlah kelahiran anak melalui bayi tabung di Jawa Barat juga masih terbilang sedikit. ADVERTISEMENT SCROLL TO CONTINUE WITH CONTENT ""Presentasi bayi IVF di Jabar sangat kecil, padahal penduduknya mencapai 50 juta jiwa. Dalam setahun (bayi yang lahir dari IVF) bahkan tidak mencapai 2.000 orang. Apakah karena IVF belum banyak diketahui masyarakat, atau memang karena biayanya yang mahal,"" ungkap dr Hanom di Bandung, Minggu (14/9/2025). Oleh karena itu, pihaknya saat ini telah berupaya menghadirkan layanan program IVF dengan harga yang lebih terjangkau. Layanan IVF di RSIA Grha Bunda Kota Bandung bisa diperoleh dengan harga mulai dari Rp 45 jutaan. ""Tidak murah, tapi lebih terjangkau. Di Indonesia sudah cukup banyak klinik bayi tabung dengan harga di atas Rp 50 jutaan,"" terangnya. Meski lebih murah, layanan yang diberikan tetap mengikuti standar IVF pada umumnya. Artinya, tidak ada fasilitas atau proses yang dikurangi. Tingkat keberhasilannya pun ditargetkan sama dengan IVF konvensional. ""Yang kita terapkan itu bukan low cost IVF. Low cost IVF sudah jarang diterapkan di dunia, karena dosis yang diberikan minimal dan angka keberhasilannya kecil,"" paparnya. dr Hanom menjelaskan, biaya bisa ditekan dengan melakukan efisiensi prosedur IVF dari seluruh lini, serta adanya bantuan subsidi obat-obatan dari rekanan farmasi. ""Harga Rp 45 juta itu pun untuk pasien tertentu, seperti kasus pasien PCO (polycystic ovaries), karena dosis yang dibutuhkan tidak terlalu tinggi. Setiap pasien juga memiliki respon yang berbeda-beda,"" ungkapnya. Dengan harga tersebut, pihaknya menargetkan angka keberhasilan 30-40 persen, sama dengan standar keberhasilan IVF di dunia. Menurutnya, pastinya tidak ada yang 100 persen. Pasien juga dapat memilih layanan medis PGT-A. Layanan tersebut menjadi langkah pemeriksaan genetik untuk memilih embrio normal sebelum dilakukan transfer embrio ke dalam rahim. PGT-A juga dapat mendeteksi kelainan kromosom embrio dan menurunkan potensi keguguran. Jadi, peluang keberhasilan menjadi lebih besar. ""Sebelum ditransfer, kita pilih genetik yang bagus terlebih dahulu. Hal ini penting untuk ibu di atas usia 40 tahun atau kehamilan dengan riwayat kelainan genetik,"" jelasnya. "
5 Manfaat dan Bahaya Makan Kolang-Kaling Berlebihan;;https://health.detik.com/berita-detikhealth/d-8112403/5-manfaat-dan-bahaya-makan-kolang-kaling-berlebihan;Senin, 15 Sep 2025 11:32;Kolang-kaling kerap kali ditemukan dalam berbagai sajian tradisional khas Indonesia.;"Kolang-kaling kerap kali ditemukan dalam berbagai sajian tradisional khas Indonesia. Teksturnya yang kenyal dan segar membuatnya populer sebagai campuran minuman dingin, seperti es buah, es campur, atau bahkan dijadikan manisan. Bahan makanan ini berasal dari biji pohon aren yang diolah dengan cara khusus hingga menghasilkan potongan putih transparan yang lembut saat digigit. Selain menyegarkan, kolang-kaling juga dikenal memiliki manfaat kesehatan. Berikut penjelasannya. ADVERTISEMENT SCROLL TO CONTINUE WITH CONTENT Spesialis gizi klinis, dr Oki Yonatan Oentiono, SpGK, PNS (Physician Nutrition Specialist) beberapa waktu lalu mengatakan kolang-kaling merupakan sumber makanan yang kaya kalium, sehingga baik untuk tulang. ""Jadi kolang-kaling ini ada banyak kandungannya. Dia salah satu makanan yang mengandung kalium. Jadi baik untuk tulang dan menjaga kesehatan tulang,"" kata dr Oki saat berbincang dengan detikcom, Jumat (7/3/2025). Kolang kaling juga memiliki kandungan serat yang cukup tinggi, sehingga bisa membantu melancarkan buang air besar sekaligus menjaga kesehatan pencernaan. Selain itu, kolang-kaling juga kaya akan air, sehingga dapat membantu mencegah dehidrasi. Tak hanya itu, dr Oki menjelaskan bahwa kolang-kaling mengandung kolagen yang baik untuk kesehatan kulit. ""Kolang-kaling juga mengandung kolagen, jadi dia juga bisa membantu kesehatan kulit. Ada juga berbagai macam zat gizi, seperti vitamin A, asam folat, zat besi, kalium, dan zinc,"" tutupnya. dr Oki menjelaskan kolang-kaling memang memiliki efek anti-radang. Ia menyebutkan, kandungan galaktomanan di dalam kolang-kaling berperan sebagai zat anti-nyeri dan anti-inflamasi yang bisa membantu meredakan keluhan seperti nyeri sendi, rematik, pengapuran, hingga sakit lutut. Meski demikian, dr Oki menegaskan bahwa belum ada penelitian yang secara spesifik membuktikan kemampuan kolang-kaling dalam mengobati nyeri sendi atau lutut. Dari sisi kedokteran, uji coba memang menunjukkan adanya efek anti-radang, tetapi belum bisa dikatakan sebagai pengobatan khusus untuk masalah sendi. Kalau kita lihat memang di kolang-kaling itu ada kandungannya galaktomanan, bisa buat apa? Anti-nyeri, anti-radang,"" kata dr Oki. ""Memang dari sisi kedokteran, hasil uji cobanya menyebutkan kalau kolang kaling ini punya efek anti-radang atau anti-inflamasi. Tapi kalau spesifik untuk (mengobati) nyeri sendi, peradangan sendi, belum ada tadi,"" katanya. Menurut dr Oki, kolang-kaling mengandung kalsium dan fosfor yang bermanfaat untuk menjaga kesehatan gigi ""Ada kalsium, fosfor dan itu baik untuk kesehatan gigi dan sendi,"" kata dr Oki. Meskipun kandungan nutrisinya memiliki banyak manfaat untuk kesehatan, kolang-kaling sebaiknya memang tidak dikonsumsi secara berlebihan dalam bentuk es campur dan semacamnya. Ada risiko yang muncul jika berlebihan, termasuk perut kembung. Sebaiknya berapa banyak mengonsumsi kolang kaling? Menurut dr Oki, tidak ada angka pasti terkait hal tersebut. Sebab, setiap orang memiliki batas toleransi yang berbeda-beda terhadap suatu makanan, termasuk kolang-kaling. ""Tapi kalau kita makan makanan alami itu pasti ada 'rem'-nya sendiri dari tubuh. Nggak mungkin kita berlebihan, (tubuh) kita juga ada batasnya,"" kata dr Oki. dr Oki juga menekankan masalah-masalah kesehatan yang mungkin muncul bukan berasal dari kolang-kalingnya. Tetapi dari campuran-campuran kolang-kaling itu sendiri. ""Kolang-kalingnya itu nggak papa. Biasanya yang jadi apa-apa itu dari sirupnya, dari gulanya,"" katanya. Ditinjau oleh:Mhd. Aldrian, S.Gz, lulusan ilmu gizi Universitas Andalas, saat ini menjadi penulis lepas di detikcom."
Pilu Bocah Meninggal karena Gangguan Otak Langka Akibat Komplikasi Campak;;https://health.detik.com/berita-detikhealth/d-8112286/pilu-bocah-meninggal-karena-gangguan-otak-langka-akibat-komplikasi-campak;Senin, 15 Sep 2025 10:31;Seorang anak usia sekolah di Los Angeles meninggal dunia akibat komplikasi campak langka, beberapa tahun setelah terinfeksi virus tersebut.;"Seorang anak usia sekolah di Los Angeles meninggal dunia akibat komplikasi campak langka, beberapa tahun setelah terinfeksi virus tersebut. Departemen Kesehatan Wilayah Los Angeles mengumumkan kematian tersebut pada hari Kamis, sebagai bagian dari peringatan bagi warga tentang pentingnya vaksinasi. Departemen tersebut mengatakan bahwa anak itu tertular campak saat bayi sebelum mereka memenuhi syarat untuk mendapatkan vaksin campak-gondongan-rubella (MMR) pertama mereka. Dosis pertama harus diberikan kepada bayi pada usia 12 hingga 15 bulan, diikuti dengan dosis kedua pada usia 4 hingga 6 tahun. Anak tersebut sembuh, tetapi bertahun-tahun kemudian mengalami gangguan otak progresif langka yang dikenal sebagai panensefalitis sklerosis subakut atau subacute sclerosing panencephalitis (SSPE). Kondisi ini dapat terjadi pada orang yang terinfeksi campak di awal kehidupan, biasanya sekitar 2 hingga 10 tahun setelah infeksi awal. ADVERTISEMENT SCROLL TO CONTINUE WITH CONTENT ""Kasus ini merupakan pengingat yang menyakitkan betapa berbahayanya campak, terutama bagi anggota masyarakat kita yang paling rentan,"" ujar Dr. Muntu Davis, petugas kesehatan Los Angeles dikutip dari NBC News, Senin (15/9/2025). ""Vaksinasi bukan hanya tentang melindungi diri sendiri - ini tentang melindungi keluarga, tetangga, dan terutama anak-anak yang terlalu muda untuk divaksinasi,"" ujarnya. Sekitar 1 dari 10.000 orang yang terinfeksi campak bisa mengalami SSPE. Tetapi jika terinfeksi saat bayi, risikonya menjadi 1 dari 600.   Gangguan otak ini memengaruhi sistem saraf pusat, sehingga penderita dapat mengalami kejang atau kehilangan kemampuan berjalan sebelum jatuh koma atau kondisi vegetatif. Belum ada obat atau pengobatan yang efektif untuk gangguan ini, dan sebagian besar pasien meninggal dalam satu hingga tiga tahun setelah diagnosis. Tahun ini menandai wabah terburuk campak sejak AS memberantas penyakit tersebut pada tahun 2000. Pusat Pengendalian dan Pencegahan Penyakit telah mencatat 1.454 kasus sejak awal tahun, melampaui rekor sebelumnya pada tahun 2019 yang didorong oleh wabah di komunitas Yahudi Ortodoks di New York dengan tingkat vaksinasi yang rendah. "
Pasutri Stres Barengan, Ternyata Gangguan Jiwa Bisa 'Menular' ke Pasangan;;https://health.detik.com/berita-detikhealth/d-8112241/pasutri-stres-barengan-ternyata-gangguan-jiwa-bisa-menular-ke-pasangan;Senin, 15 Sep 2025 10:01;Studi terbaru menemukan penyakit jiwa bisa 'menular' antar pasangan suami-istri.;"Studi terbaru menemukan penyakit jiwa bisa 'menular' antar pasangan suami-istri. Berdasarkan analisis terhadap 6 juta pasangan di Taiwan, Denmark, dan Swedia, peneliti menemukan seseorang memiliki kemungkinan lebih besar untuk mengalami gangguan jiwa yang sama dengan pasangan. Gangguan yang dimaksud mencakup skizofrenia, attention deficit hyperactivity disorder (ADHD), depresi, autisme, kecemasan, gangguan bipolar, obsessive-compulsive disorder (OCD), penyalahgunaan zat, dan anoreksia nervosa. ""Kami menemukan bahwa sebagian besar gangguan kejiwaan memiliki korelasi pasangan yang konsisten lintas negara dan lintas generasi, yang menunjukkan pentingnya hal ini dalam dinamika populasi gangguan kejiwaan,"" tulis peneliti dikutip dari Science Alert, Senin (15/9/2025). ADVERTISEMENT SCROLL TO CONTINUE WITH CONTENT Mereka menyebut ini sebagai fenomena spousal correlation atau korelasi pasangan. Sebelumnya, ditemukan korelasi tertinggi ada pada agama, pandangan politik, tingkat pendidikan, serta kebiasaan penggunaan zat.  Menurut ahli ada tiga faktor yang berperan dari kejadian ini. Ini meliputi manusia cenderung memilih pasangan yang mirip, manusia memilih pasangan di lingkungan atau lingkaran terbatas, hingga pasangan yang hidup bersama dalam waktu lama cenderung semakin mirip. Ketiga negara sebenarnya memiliki budaya dan sistem kesehatan yang berbeda. Meski ada terdapat perbedaan pada kasus OCD, bipolar, dan anoreksia, hasil penelitian menunjukkan kesamaan statistik di seluruh dataset lainnya. ""Seperti yang ditunjukkan hasil kami, kemiripan pasangan dalam dan antar-pasangan gangguan kejiwaan konsisten di berbagai negara dan bertahan lintas generasi, menunjukkan fenomena universal,"" tulis peneliti.   Terdapat sejumlah keterbatasan dalam studi ini, misal studi ini tidak membedakan pasangan yang bertemu sebelum atau setelah diagnosis. Meski begitu, pola yang terlihat cukup kuat sehingga tetap bermakna bagi kajian kesehatan mental. Peneliti juga menambahkan, dua orang tua dengan gangguan jiwa yang sama meningkatkan risiko gangguan itu juga muncul pada anak. ""Mengingat begitu meluasnya korelasi pasangan, penting untuk mempertimbangkan pola pasangan yang tidak acak ketika merancang studi genetika tentang gangguan kejiwaan,"" tandas peneliti. "
Heboh Ortu di Korsel Jalani IVF Khusus Biar Bisa Request Jenis Kelamin Anak;;https://health.detik.com/berita-detikhealth/d-8112133/heboh-ortu-di-korsel-jalani-ivf-khusus-biar-bisa-request-jenis-kelamin-anak;Senin, 15 Sep 2025 08:30;Seorang perempuan yang disamarkan dengan nama 'Sohan' menceritakan pengalamannya menjalani fertilisasi in vitro (IVF) khusus untuk bisa memilih jenis kelamin bayi yang ingin dilahirkan.;"Seorang perempuan yang disamarkan dengan nama 'Sohan' menceritakan pengalamannya menjalani fertilisasi in vitro (IVF) khusus untuk bisa memilih jenis kelamin bayi yang ingin dilahirkan. Perempuan berusia 30-an ini menjalani IVF khusus di Bangkok, Thailand karena prosedur ini ilegal di Korea Selatan, menurut Undang-Undang Bioetika dan Keamanan. Sohan dan suaminya ingin mendapatkan anak laki-laki, setelah sebelumnya mereka memiliki anak perempuan. Sekitar 10 bulan setelah menjalani IVF khusus di Bangkok, ia akhirnya bisa melahirkan anak laki-laki yang diinginkan. Sohan menceritakan sebenarnya ada banyak orang tua yang menjalani prosedur serupa di luar negeri. ADVERTISEMENT SCROLL TO CONTINUE WITH CONTENT ""Aku pertama kali tahu tentang hal ini beberapa tahun lalu karena kerabat temanku mencoba program kehamilan dengan seleksi jenis kelamin di Hong Kong,"" cerita Sohan dikutip dari Korea JoongAng Daily, Senin (15/9/2025).  Di Korea, Undang-Undang Bioetika dan Keamanan yang diberlakukan pada 2005 melarang pembuahan sel telur dengan tujuan memilih jenis kelamin tertentu. Tenaga medis yang melakukan perawatan kesuburan berbasis seleksi gender bisa dipenjara hingga dua tahun atau didenda maksimal 30 juta won (Rp 353,4 juta rupiah). Larangan kehamilan berbasis seleksi gender awalnya dimaksudkan untuk mengurangi praktik aborsi. Ini terjadi khususnya pada 1980-1990-an ketika preferensi anak laki-laki lebih dominan di masyarakat Korea. Berdasarkan undang-undang, ibu hamil, termasuk yang menjalani IVF, harus menunggu hingga sekitar usia kehamilan 15 minggu untuk mengetahui jenis kelamin janinnya lewat USG. Namun, tidak ada aturan yang melarang orang Korea menjalani perawatan kesuburan di luar negeri. ""Kebanyakan orang yang menghubungiku adalah mereka yang sudah punya anak. Mereka hanya ingin anak berikutnya berbeda jenis kelamin dari anak yang sudah lahir,"" ujar Sohan menyebut tidak ada kecenderungan orang tua di Korsel mengutamakan anak laki-laki.   Prosedur yang Dijalani Sohan Sohan menghabiskan sekitar 450 ribu baht (Rp 232,7 juta) untuk prosedur tersebut. Sedangkan, untuk satu kali prosedur IVF di Korea Selatan dapat menghabiskan 2 juta won (Rp 23,5 juta). Sohan menjelaskan proses IVF di Korea Selatan dan Thailand sebenarnya hampir sama. Namun, di Thailand orang tua menempuh tiga tahapan tambahan yaitu skrining embrio berdasarkan jenis kelamin, membekukan embrio sebelum ditanamkan, serta memiliki embrio dengan jenis kelamin tertentu. Jika IVF di Korea Selatan bisa selesai dalam 2-3 minggu, proses yang dijalani Sohan memakan waktu hingga 2 bulan. Ia mengambil sel telur pada awal April 2024, lalu baru mentransfer sel embrio pada awal Juni. ""Karena perlu waktu untuk menentukan jenis kelamin embrio yang telah dibuahi, embrio harus dibekukan sebelum ditanamkan. Klinik di Bangkok memberiku laporan harian melalui email tentang perkembangan embrio, dan aku memilih jenis kelamin anak keduaku lewat telepon,"" cerita Sohan. Setelah embrio ditanamkan, ia menjalani persalinan di Korea Selatan. Ia tidak menceritakan detail prosedur yang dijalani pada tenaga medis yang membantu kelahiran anaknya. "
