title;tag;link;date;description;content
Klinik IVF dengan Harga Terjangkau Kini Ada di Bandung;;https://health.detik.com/berita-detikhealth/d-8112544/klinik-ivf-dengan-harga-terjangkau-kini-ada-di-bandung;Senin, 15 Sep 2025 12:31;Bayi tabung atau In Vitro Fertilization (IVF) adalah program kehamilan dengan metode pembuahan sel telur oleh sperma yang dilakukan di laboratorium.;"Bayi tabung atau In Vitro Fertilization (IVF) adalah program kehamilan dengan metode pembuahan sel telur oleh sperma yang dilakukan di laboratorium. Metode ini bisa menjadi pilihan bagi pasangan yang kesulitan untuk memiliki momongan, karena masalah infertilitas yang tidak lagi bisa ditangani oleh pengobatan dan terapi konvensional. Kendati demikian, biaya bayi tabung terbilang mahal, yaitu berkisar antara Rp 60- Rp 100 juta per siklus untuk prosedurnya saja. Harga tersebut belum termasuk obat-obatan dan lain sebagainya. Sehingga, upaya menghadirkan layanan bayi tabung atau IVF yang lebih terjangkau begitu penting. Dokter obgyn Hanoum Husni Syam, SpOG, Subsp. Fer yang juga merupakan founder Rumah Sakit Ibu dan Anak Grha Bunda, Kota Bandung mengungkapkan, jumlah kelahiran anak melalui bayi tabung di Jawa Barat juga masih terbilang sedikit. ADVERTISEMENT SCROLL TO CONTINUE WITH CONTENT ""Presentasi bayi IVF di Jabar sangat kecil, padahal penduduknya mencapai 50 juta jiwa. Dalam setahun (bayi yang lahir dari IVF) bahkan tidak mencapai 2.000 orang. Apakah karena IVF belum banyak diketahui masyarakat, atau memang karena biayanya yang mahal,"" ungkap dr Hanom di Bandung, Minggu (14/9/2025). Oleh karena itu, pihaknya saat ini telah berupaya menghadirkan layanan program IVF dengan harga yang lebih terjangkau. Layanan IVF di RSIA Grha Bunda Kota Bandung bisa diperoleh dengan harga mulai dari Rp 45 jutaan. ""Tidak murah, tapi lebih terjangkau. Di Indonesia sudah cukup banyak klinik bayi tabung dengan harga di atas Rp 50 jutaan,"" terangnya. Meski lebih murah, layanan yang diberikan tetap mengikuti standar IVF pada umumnya. Artinya, tidak ada fasilitas atau proses yang dikurangi. Tingkat keberhasilannya pun ditargetkan sama dengan IVF konvensional. ""Yang kita terapkan itu bukan low cost IVF. Low cost IVF sudah jarang diterapkan di dunia, karena dosis yang diberikan minimal dan angka keberhasilannya kecil,"" paparnya. dr Hanom menjelaskan, biaya bisa ditekan dengan melakukan efisiensi prosedur IVF dari seluruh lini, serta adanya bantuan subsidi obat-obatan dari rekanan farmasi. ""Harga Rp 45 juta itu pun untuk pasien tertentu, seperti kasus pasien PCO (polycystic ovaries), karena dosis yang dibutuhkan tidak terlalu tinggi. Setiap pasien juga memiliki respon yang berbeda-beda,"" ungkapnya. Dengan harga tersebut, pihaknya menargetkan angka keberhasilan 30-40 persen, sama dengan standar keberhasilan IVF di dunia. Menurutnya, pastinya tidak ada yang 100 persen. Pasien juga dapat memilih layanan medis PGT-A. Layanan tersebut menjadi langkah pemeriksaan genetik untuk memilih embrio normal sebelum dilakukan transfer embrio ke dalam rahim. PGT-A juga dapat mendeteksi kelainan kromosom embrio dan menurunkan potensi keguguran. Jadi, peluang keberhasilan menjadi lebih besar. ""Sebelum ditransfer, kita pilih genetik yang bagus terlebih dahulu. Hal ini penting untuk ibu di atas usia 40 tahun atau kehamilan dengan riwayat kelainan genetik,"" jelasnya. "
5 Manfaat dan Bahaya Makan Kolang-Kaling Berlebihan;;https://health.detik.com/berita-detikhealth/d-8112403/5-manfaat-dan-bahaya-makan-kolang-kaling-berlebihan;Senin, 15 Sep 2025 11:32;Kolang-kaling kerap kali ditemukan dalam berbagai sajian tradisional khas Indonesia.;"Kolang-kaling kerap kali ditemukan dalam berbagai sajian tradisional khas Indonesia. Teksturnya yang kenyal dan segar membuatnya populer sebagai campuran minuman dingin, seperti es buah, es campur, atau bahkan dijadikan manisan. Bahan makanan ini berasal dari biji pohon aren yang diolah dengan cara khusus hingga menghasilkan potongan putih transparan yang lembut saat digigit. Selain menyegarkan, kolang-kaling juga dikenal memiliki manfaat kesehatan. Berikut penjelasannya. ADVERTISEMENT SCROLL TO CONTINUE WITH CONTENT Spesialis gizi klinis, dr Oki Yonatan Oentiono, SpGK, PNS (Physician Nutrition Specialist) beberapa waktu lalu mengatakan kolang-kaling merupakan sumber makanan yang kaya kalium, sehingga baik untuk tulang. ""Jadi kolang-kaling ini ada banyak kandungannya. Dia salah satu makanan yang mengandung kalium. Jadi baik untuk tulang dan menjaga kesehatan tulang,"" kata dr Oki saat berbincang dengan detikcom, Jumat (7/3/2025). Kolang kaling juga memiliki kandungan serat yang cukup tinggi, sehingga bisa membantu melancarkan buang air besar sekaligus menjaga kesehatan pencernaan. Selain itu, kolang-kaling juga kaya akan air, sehingga dapat membantu mencegah dehidrasi. Tak hanya itu, dr Oki menjelaskan bahwa kolang-kaling mengandung kolagen yang baik untuk kesehatan kulit. ""Kolang-kaling juga mengandung kolagen, jadi dia juga bisa membantu kesehatan kulit. Ada juga berbagai macam zat gizi, seperti vitamin A, asam folat, zat besi, kalium, dan zinc,"" tutupnya. dr Oki menjelaskan kolang-kaling memang memiliki efek anti-radang. Ia menyebutkan, kandungan galaktomanan di dalam kolang-kaling berperan sebagai zat anti-nyeri dan anti-inflamasi yang bisa membantu meredakan keluhan seperti nyeri sendi, rematik, pengapuran, hingga sakit lutut. Meski demikian, dr Oki menegaskan bahwa belum ada penelitian yang secara spesifik membuktikan kemampuan kolang-kaling dalam mengobati nyeri sendi atau lutut. Dari sisi kedokteran, uji coba memang menunjukkan adanya efek anti-radang, tetapi belum bisa dikatakan sebagai pengobatan khusus untuk masalah sendi. Kalau kita lihat memang di kolang-kaling itu ada kandungannya galaktomanan, bisa buat apa? Anti-nyeri, anti-radang,"" kata dr Oki. ""Memang dari sisi kedokteran, hasil uji cobanya menyebutkan kalau kolang kaling ini punya efek anti-radang atau anti-inflamasi. Tapi kalau spesifik untuk (mengobati) nyeri sendi, peradangan sendi, belum ada tadi,"" katanya. Menurut dr Oki, kolang-kaling mengandung kalsium dan fosfor yang bermanfaat untuk menjaga kesehatan gigi ""Ada kalsium, fosfor dan itu baik untuk kesehatan gigi dan sendi,"" kata dr Oki. Meskipun kandungan nutrisinya memiliki banyak manfaat untuk kesehatan, kolang-kaling sebaiknya memang tidak dikonsumsi secara berlebihan dalam bentuk es campur dan semacamnya. Ada risiko yang muncul jika berlebihan, termasuk perut kembung. Sebaiknya berapa banyak mengonsumsi kolang kaling? Menurut dr Oki, tidak ada angka pasti terkait hal tersebut. Sebab, setiap orang memiliki batas toleransi yang berbeda-beda terhadap suatu makanan, termasuk kolang-kaling. ""Tapi kalau kita makan makanan alami itu pasti ada 'rem'-nya sendiri dari tubuh. Nggak mungkin kita berlebihan, (tubuh) kita juga ada batasnya,"" kata dr Oki. dr Oki juga menekankan masalah-masalah kesehatan yang mungkin muncul bukan berasal dari kolang-kalingnya. Tetapi dari campuran-campuran kolang-kaling itu sendiri. ""Kolang-kalingnya itu nggak papa. Biasanya yang jadi apa-apa itu dari sirupnya, dari gulanya,"" katanya. Ditinjau oleh:Mhd. Aldrian, S.Gz, lulusan ilmu gizi Universitas Andalas, saat ini menjadi penulis lepas di detikcom."
Pilu Bocah Meninggal karena Gangguan Otak Langka Akibat Komplikasi Campak;;https://health.detik.com/berita-detikhealth/d-8112286/pilu-bocah-meninggal-karena-gangguan-otak-langka-akibat-komplikasi-campak;Senin, 15 Sep 2025 10:31;Seorang anak usia sekolah di Los Angeles meninggal dunia akibat komplikasi campak langka, beberapa tahun setelah terinfeksi virus tersebut.;"Seorang anak usia sekolah di Los Angeles meninggal dunia akibat komplikasi campak langka, beberapa tahun setelah terinfeksi virus tersebut. Departemen Kesehatan Wilayah Los Angeles mengumumkan kematian tersebut pada hari Kamis, sebagai bagian dari peringatan bagi warga tentang pentingnya vaksinasi. Departemen tersebut mengatakan bahwa anak itu tertular campak saat bayi sebelum mereka memenuhi syarat untuk mendapatkan vaksin campak-gondongan-rubella (MMR) pertama mereka. Dosis pertama harus diberikan kepada bayi pada usia 12 hingga 15 bulan, diikuti dengan dosis kedua pada usia 4 hingga 6 tahun. Anak tersebut sembuh, tetapi bertahun-tahun kemudian mengalami gangguan otak progresif langka yang dikenal sebagai panensefalitis sklerosis subakut atau subacute sclerosing panencephalitis (SSPE). Kondisi ini dapat terjadi pada orang yang terinfeksi campak di awal kehidupan, biasanya sekitar 2 hingga 10 tahun setelah infeksi awal. ADVERTISEMENT SCROLL TO CONTINUE WITH CONTENT ""Kasus ini merupakan pengingat yang menyakitkan betapa berbahayanya campak, terutama bagi anggota masyarakat kita yang paling rentan,"" ujar Dr. Muntu Davis, petugas kesehatan Los Angeles dikutip dari NBC News, Senin (15/9/2025). ""Vaksinasi bukan hanya tentang melindungi diri sendiri - ini tentang melindungi keluarga, tetangga, dan terutama anak-anak yang terlalu muda untuk divaksinasi,"" ujarnya. Sekitar 1 dari 10.000 orang yang terinfeksi campak bisa mengalami SSPE. Tetapi jika terinfeksi saat bayi, risikonya menjadi 1 dari 600.   Gangguan otak ini memengaruhi sistem saraf pusat, sehingga penderita dapat mengalami kejang atau kehilangan kemampuan berjalan sebelum jatuh koma atau kondisi vegetatif. Belum ada obat atau pengobatan yang efektif untuk gangguan ini, dan sebagian besar pasien meninggal dalam satu hingga tiga tahun setelah diagnosis. Tahun ini menandai wabah terburuk campak sejak AS memberantas penyakit tersebut pada tahun 2000. Pusat Pengendalian dan Pencegahan Penyakit telah mencatat 1.454 kasus sejak awal tahun, melampaui rekor sebelumnya pada tahun 2019 yang didorong oleh wabah di komunitas Yahudi Ortodoks di New York dengan tingkat vaksinasi yang rendah. "
Pasutri Stres Barengan, Ternyata Gangguan Jiwa Bisa 'Menular' ke Pasangan;;https://health.detik.com/berita-detikhealth/d-8112241/pasutri-stres-barengan-ternyata-gangguan-jiwa-bisa-menular-ke-pasangan;Senin, 15 Sep 2025 10:01;Studi terbaru menemukan penyakit jiwa bisa 'menular' antar pasangan suami-istri.;"Studi terbaru menemukan penyakit jiwa bisa 'menular' antar pasangan suami-istri. Berdasarkan analisis terhadap 6 juta pasangan di Taiwan, Denmark, dan Swedia, peneliti menemukan seseorang memiliki kemungkinan lebih besar untuk mengalami gangguan jiwa yang sama dengan pasangan. Gangguan yang dimaksud mencakup skizofrenia, attention deficit hyperactivity disorder (ADHD), depresi, autisme, kecemasan, gangguan bipolar, obsessive-compulsive disorder (OCD), penyalahgunaan zat, dan anoreksia nervosa. ""Kami menemukan bahwa sebagian besar gangguan kejiwaan memiliki korelasi pasangan yang konsisten lintas negara dan lintas generasi, yang menunjukkan pentingnya hal ini dalam dinamika populasi gangguan kejiwaan,"" tulis peneliti dikutip dari Science Alert, Senin (15/9/2025). ADVERTISEMENT SCROLL TO CONTINUE WITH CONTENT Mereka menyebut ini sebagai fenomena spousal correlation atau korelasi pasangan. Sebelumnya, ditemukan korelasi tertinggi ada pada agama, pandangan politik, tingkat pendidikan, serta kebiasaan penggunaan zat.  Menurut ahli ada tiga faktor yang berperan dari kejadian ini. Ini meliputi manusia cenderung memilih pasangan yang mirip, manusia memilih pasangan di lingkungan atau lingkaran terbatas, hingga pasangan yang hidup bersama dalam waktu lama cenderung semakin mirip. Ketiga negara sebenarnya memiliki budaya dan sistem kesehatan yang berbeda. Meski ada terdapat perbedaan pada kasus OCD, bipolar, dan anoreksia, hasil penelitian menunjukkan kesamaan statistik di seluruh dataset lainnya. ""Seperti yang ditunjukkan hasil kami, kemiripan pasangan dalam dan antar-pasangan gangguan kejiwaan konsisten di berbagai negara dan bertahan lintas generasi, menunjukkan fenomena universal,"" tulis peneliti.   Terdapat sejumlah keterbatasan dalam studi ini, misal studi ini tidak membedakan pasangan yang bertemu sebelum atau setelah diagnosis. Meski begitu, pola yang terlihat cukup kuat sehingga tetap bermakna bagi kajian kesehatan mental. Peneliti juga menambahkan, dua orang tua dengan gangguan jiwa yang sama meningkatkan risiko gangguan itu juga muncul pada anak. ""Mengingat begitu meluasnya korelasi pasangan, penting untuk mempertimbangkan pola pasangan yang tidak acak ketika merancang studi genetika tentang gangguan kejiwaan,"" tandas peneliti. "
Heboh Ortu di Korsel Jalani IVF Khusus Biar Bisa Request Jenis Kelamin Anak;;https://health.detik.com/berita-detikhealth/d-8112133/heboh-ortu-di-korsel-jalani-ivf-khusus-biar-bisa-request-jenis-kelamin-anak;Senin, 15 Sep 2025 08:30;Seorang perempuan yang disamarkan dengan nama 'Sohan' menceritakan pengalamannya menjalani fertilisasi in vitro (IVF) khusus untuk bisa memilih jenis kelamin bayi yang ingin dilahirkan.;"Seorang perempuan yang disamarkan dengan nama 'Sohan' menceritakan pengalamannya menjalani fertilisasi in vitro (IVF) khusus untuk bisa memilih jenis kelamin bayi yang ingin dilahirkan. Perempuan berusia 30-an ini menjalani IVF khusus di Bangkok, Thailand karena prosedur ini ilegal di Korea Selatan, menurut Undang-Undang Bioetika dan Keamanan. Sohan dan suaminya ingin mendapatkan anak laki-laki, setelah sebelumnya mereka memiliki anak perempuan. Sekitar 10 bulan setelah menjalani IVF khusus di Bangkok, ia akhirnya bisa melahirkan anak laki-laki yang diinginkan. Sohan menceritakan sebenarnya ada banyak orang tua yang menjalani prosedur serupa di luar negeri. ADVERTISEMENT SCROLL TO CONTINUE WITH CONTENT ""Aku pertama kali tahu tentang hal ini beberapa tahun lalu karena kerabat temanku mencoba program kehamilan dengan seleksi jenis kelamin di Hong Kong,"" cerita Sohan dikutip dari Korea JoongAng Daily, Senin (15/9/2025).  Di Korea, Undang-Undang Bioetika dan Keamanan yang diberlakukan pada 2005 melarang pembuahan sel telur dengan tujuan memilih jenis kelamin tertentu. Tenaga medis yang melakukan perawatan kesuburan berbasis seleksi gender bisa dipenjara hingga dua tahun atau didenda maksimal 30 juta won (Rp 353,4 juta rupiah). Larangan kehamilan berbasis seleksi gender awalnya dimaksudkan untuk mengurangi praktik aborsi. Ini terjadi khususnya pada 1980-1990-an ketika preferensi anak laki-laki lebih dominan di masyarakat Korea. Berdasarkan undang-undang, ibu hamil, termasuk yang menjalani IVF, harus menunggu hingga sekitar usia kehamilan 15 minggu untuk mengetahui jenis kelamin janinnya lewat USG. Namun, tidak ada aturan yang melarang orang Korea menjalani perawatan kesuburan di luar negeri. ""Kebanyakan orang yang menghubungiku adalah mereka yang sudah punya anak. Mereka hanya ingin anak berikutnya berbeda jenis kelamin dari anak yang sudah lahir,"" ujar Sohan menyebut tidak ada kecenderungan orang tua di Korsel mengutamakan anak laki-laki.   Prosedur yang Dijalani Sohan Sohan menghabiskan sekitar 450 ribu baht (Rp 232,7 juta) untuk prosedur tersebut. Sedangkan, untuk satu kali prosedur IVF di Korea Selatan dapat menghabiskan 2 juta won (Rp 23,5 juta). Sohan menjelaskan proses IVF di Korea Selatan dan Thailand sebenarnya hampir sama. Namun, di Thailand orang tua menempuh tiga tahapan tambahan yaitu skrining embrio berdasarkan jenis kelamin, membekukan embrio sebelum ditanamkan, serta memiliki embrio dengan jenis kelamin tertentu. Jika IVF di Korea Selatan bisa selesai dalam 2-3 minggu, proses yang dijalani Sohan memakan waktu hingga 2 bulan. Ia mengambil sel telur pada awal April 2024, lalu baru mentransfer sel embrio pada awal Juni. ""Karena perlu waktu untuk menentukan jenis kelamin embrio yang telah dibuahi, embrio harus dibekukan sebelum ditanamkan. Klinik di Bangkok memberiku laporan harian melalui email tentang perkembangan embrio, dan aku memilih jenis kelamin anak keduaku lewat telepon,"" cerita Sohan. Setelah embrio ditanamkan, ia menjalani persalinan di Korea Selatan. Ia tidak menceritakan detail prosedur yang dijalani pada tenaga medis yang membantu kelahiran anaknya. "
Kata Dokter Harvard, Teknik Jalan Kaki Ini Bisa Bikin Jantung Sehat-Cegah Stroke;;https://health.detik.com/berita-detikhealth/d-8111814/kata-dokter-harvard-teknik-jalan-kaki-ini-bisa-bikin-jantung-sehat-cegah-stroke;Senin, 15 Sep 2025 08:00;Seorang ahli gastroenterologi terkemuka yang menempuh pendidikan di Harvard, Stanford, dan AIIMS, dr Saurabh Sethi, merekomendasikan teknik jalan kaki yang dapat menyehatkan tubuh.;"Seorang ahli gastroenterologi terkemuka yang menempuh pendidikan di Harvard, Stanford, dan AIIMS, dr Saurabh Sethi, merekomendasikan teknik jalan kaki yang dapat menyehatkan tubuh. Teknik tersebut adalah metode jalan kaki interval ala Jepang. Dalam penjelasannya, dr Sethi menyebut metode ini memberikan hasil yang lebih baik daripada jalan kaki biasa 10 ribu langkah setiap hari. ""Metode latihan ini melibatkan jalan lambat dan cepat secara bergantian selama tiga menit setiap interval. Teknik jalan kaki yang dikembangkan di Jepang ini hanya membutuhkan 30 menit per hari untuk memberikan berbagai manfaat kesehatan,"" terangnya yang dikutip dariTimes of India. ADVERTISEMENT SCROLL TO CONTINUE WITH CONTENT Metode ini melibatkan perubahan kecepatan berjalan di antara berbagai kecepatan. Mulai dari jalan lambat selama tiga menit, diikuti dengan tiga menit berjalan cepat. Latihan ini dilakukan bergantian antara jalan lambat dan cepat, dengan total durasi 30 menit. dr Sethi merekomendasikan untuk memulai dengan pemanasan selama 3-5 menit dengan kecepatan yang nyaman, diikuti dengan periode pendinginan selama 3-5 menit untuk membantu transisi jantung dan otot. Sistem latihan ini menyediakan pendekatan kebugaran yang sederhana, yang terintegrasi dengan mulus ke dalam aktivitas rutin tanpa memerlukan komitmen waktu yang lama. Berikut sederet manfaatnya:   Dr Sethi mengungkapkan bahwa jalan interval memberikan manfaat luar biasa untuk menjaga kesehatan jantung. Jantung dan pembuluh darah menjadi lebih kuat dan fleksibel saat berjalan dengan kecepatan yang berbeda selama latihan interval. Program latihan ini membantu mengontrol tekanan darah sekaligus mengurangi risiko masalah jantung, seperti hipertensi dan stroke. Latihan yang intens memberikan manfaat yang lebih baik bagi jantung dibandingkan berjalan stabil dalam waktu yang lebih lama. Penelitian menunjukkan bahwa jalan interval meningkatkan kebugaran aerobik melalui konsumsi oksigen puncak yang lebih baik, dan otot yang lebih kuat. Metode ini memberikan hasil yang lebih menjanjikan. Stroke merupakan kondisi medis kritis yang berkembang saat pembuluh darah otak tersumbat atau pecah. Dr Sethi menunjukkan bahwa jalan interval menurunkan risiko stroke melalui kemampuannya untuk meningkatkan sirkulasi darah dan menurunkan hipertensi, yang merupakan faktor risiko utama stroke. Kecepatan berbeda selama latihan interval membantu arteri tetap fleksibel, sekaligus membuang timbunan kolesterol yang menyebabkan penyumbatan pembuluh darah. Otak menerima perlindungan melalui sirkulasi yang lebih baik dan menghasilkan peningkatan energi serta kejernihan mental.    Olahraga memicu otak untuk memproduksi endorfin, yang berfungsi sebagai zat kimia peningkat suasana hati. Interval cepat dalam jalan interval menciptakan manfaat kesehatan mental yang lebih baik. Dr Sethi menunjukkan metode berjalan ini dapat meredakan stres dan mengurangi kecemasan, meningkatkan kualitas tidur, dan memberikan peningkatan energi. Orang yang berlatih jalan interval mengalami peningkatan suasana hati, motivasi, dan peningkatan energi harian. Jalan interval ala Jepang ini sangat ramah untuk sendi, karena menghindari stres yang berdampak tinggi seperti yang disebabkan oleh lari atau aktivitas fisik intens lainnya. Latihan bergantian antara jalan lambat dan cepat memungkinkan otot tanpa memberikan tekanan berlebihan pada sendi. dr Sethi merekomendasikan pejalan kaki baru untuk memulai dengan pemanasan ringan, seperti berjalan kaki dengan nyaman sebelum memulai interval. Pola latihan ini melibatkan pergantian antara: Di akhir latihan, lakukan jalan kaki dengan intensitas yang lambat. Hal ini membantu menormalkan detak jantung dan pola pernapasan. "
Ahli Wanti-wanti Kasus Kanker Usus Buntu Meningkat di Usia Muda, Inikah Pemicunya?;;https://health.detik.com/berita-detikhealth/d-8111817/ahli-wanti-wanti-kasus-kanker-usus-buntu-meningkat-di-usia-muda-inikah-pemicunya;Senin, 15 Sep 2025 07:00;Para ahli mulai mewanti-wanti soal peningkatan kasus kanker apendiks atau kanker usus buntu.;"Para ahli mulai mewanti-wanti soal peningkatan kasus kanker apendiks atau kanker usus buntu. Disebutkan bahwa peningkatan diagnosis yang tiba-tiba ini terjadi pada orang berusia di bawah 50 tahun, dan tidak bisa dijelaskan. Sebuah studi yang dipublikasikan di Annals of Internal Medicine menunjukkan jumlah kasus kanker usus buntu meningkat drastis, di kalangan orang yang lahir setelah tahun 1970-an. Jumlahnya meningkat 3-4 kali lipat pada generasi muda. ""Selama beberapa dekade, penyakit ini mungkin hanya ditemui dokter sekali atau dua kali dalam kariernya. Dan hampir selalu ditemukan pada orang dewasa yang lebih tua,"" tutur ahli onkologi dan peneliti di Anglia Ruskin University, Profesor Justin Stebbing. ADVERTISEMENT SCROLL TO CONTINUE WITH CONTENT ""Namun, peningkatan kasus kanker usus buntu sangat tajam, terutama pada orang muda."" Profesor Stebbing menjelaskan kanker usus besar kini lebih banyak dialami orang berusia 30-an dan 40-an, dengan bentuk kanker agresif. Tetapi, ia mengaku tidak benar-benar tahu mengapa ini bisa terjadi. Teori yang berlaku adalah peran pola makan, khususnya ultra-olahan (ultra-process). Tetapi, tidak ada penjelasan yang jelas tentang mekanisme yang menghubungkan hal ini dengan kanker. ""Saya pikir kemungkinan besar peningkatan obesitas adalah penyebab peningkatan ini. Tetapi, kita tidak benar-benar tahu,"" terangnya dalam studi tersebut.   Apendiks adalah kantong jaringan kecil yang terhubung ke usus di sisi kanan bawah perut. Organ ini merupakan bagian dari usus dan membantu membuang limbah dari tubuh. Meski fungsi pastinya belum diketahui, para ahli mengatakan bahwa organ ini dapat membantu mendukung sistem kekebalan tubuh. Tetapi, organ ini juga dapat menghasilkan sel kanker, yang mulai membelah tak terkendali, membentuk tumor. Tumor ini dapat tumbuh dari sel-sel yang melapisi usus buntu atau zat kimia yang terlibat dalam pencernaan. Kanker usus buntu masih jarang terjadi dan diperkirakan hanya 0,4 persen dari seluruh kanker usus. Artinya, sekitar 176 orang didiagnosis dengan bentuk penyakit ini. Hal yang menjadi kekhawatiran para ahli adalah satu dari tiga kasus sekarang terjadi pada orang dewasa di bawah 50 tahun.    Para ahli memperingatkan bahwa gejalanya samar dan mudah diabaikan. Orang mungkin mengalami nyeri perut ringan, kembung, atau perubahan kebiasaan buang air besar. ""Akibatnya, sebagian besar kasus baru ditemukan setelah operasi untuk dugaan apendisitis, saat seringkali sudah terlambat untuk intervensi dini,"" tulis Dr Stebbing. Penyakit ini dapat menyebar ke berbagai bagian perut, yang menyebabkan nyeri hebat. Tren peningkatan yang sedikit pada penyakit ini tampaknya lebih cepat daripada tren pada kanker usus besar secara keseluruhan. Di antara orang dewasa berusia 20 hingga 39 tahun, perkiraan menunjukkan kasus meningkat rata-rata dua persen per tahun. Pada mereka yang berusia 30 hingga 39 tahun, kasus meningkat lima persen per tahun secara keseluruhan. ""Namun, selama 30 tahun terakhir, diagnosis kanker usus besar pada usia muda telah melonjak hingga 80 persen di seluruh dunia,"" menurut penelitian. "
