title;tag;link;date;description;content
Klaim BPJS Kesehatan untuk Gangguan Jiwa Naik! Hampir Rp 2 Triliun, Ini Rinciannya;;https://health.detik.com/berita-detikhealth/d-8115094/klaim-bpjs-kesehatan-untuk-gangguan-jiwa-naik-hampir-rp-2-triliun-ini-rinciannya;2025-09-16 10:22:44;Direktur Utama BPJS Kesehatan Ali Ghufron Mukti mengungkapkan bahwa nilai klaim program Jaminan Kesehatan Nasional (JKN) untuk masalah kesehatan mental mencapai Rp 6 triliun lebih.;"Direktur Utama BPJS Kesehatan Ali Ghufron Mukti mengungkapkan bahwa nilai klaim program Jaminan Kesehatan Nasional (JKN) untuk masalah kesehatan mental mencapai Rp 6 triliun lebih. Jumlah tersebut berdasarkan data nilai pengeluaran total periode tahun 2020-2024. Ghufron menyebut jumlah biaya yang dikeluarkan untuk menangani masalah kesehatan mental naik setiap tahun. ""Biayanya dalam waktu 2020-2024, sekitar Rp 6,7 triliun. Biaya untuk merawat yang sudah dibayar oleh BPJS untuk perawatan orang dengan gangguan jiwa (ODGJ),"" kata Ghufron ketika ditemui awak media di Surakarta, Jawa Tengah, Selasa (16/9/2025). ADVERTISEMENT SCROLL TO CONTINUE WITH CONTENT Untuk tahun 2024, biaya yang dikeluarkan oleh BPJS Kesehatan mencapai Rp 1,9 triliun. Jumlah itu meningkat dari tahun 2023 dengan Rp 1,6 triliun, tahun 2022 dengan Rp 1,2 triliun, tahun 2021 dengan Rp 1 triliun, dan tahun 2020 dengan Rp 937 miliar.   ""Yang menarik tahun 2024 itu, sudah hampir Rp 2 triliun biayanya, kasusnya meningkat. Kalau kita lihat dari 2,6 juta (klaim kasus) tahun 2020 ini meningkat terus sampai 5.186.418 kasus tahun 2024. Ini luar biasa,"" tandasnya. Berdasarkan jenis penyakit, berikut ini sederet masalah kesehatan mental dengan nilai pembiayaan BPJS Kesehatan tertinggi: "
Catat Rekor Baru, Pria Ini Positif COVID-19 Selama 2 Tahun!;;https://health.detik.com/berita-detikhealth/d-8114957/catat-rekor-baru-pria-ini-positif-covid-19-selama-2-tahun;2025-09-16 09:22:47;Seorang pria dengan sistem kekebalan tubuh yang lemah mengidap COVID-19 akut yang berkelanjutan selama lebih dari 750 hari.;"Seorang pria dengan sistem kekebalan tubuh yang lemah mengidap COVID-19 akut yang berkelanjutan selama lebih dari 750 hari. Selama periode ini, ia mengalami gejala pernapasan yang persisten dan dirawat di rumah sakit sebanyak lima kali. Meski durasinya panjang, kondisi pria ini berbeda dengan long COVID. Sebab, gejalanya bukanlah gejala yang menetap setelah virus menghilang, melainkan fase virus SARS-CoV-2 yang berlanjut selama lebih dari dua tahun. Kondisi ini mungkin hanya terjadi pada orang yang rentan. Tetapi, para ahli di Amerika Serikat memperingatkan dalam studi baru mereka. ADVERTISEMENT SCROLL TO CONTINUE WITH CONTENT ""Infeksi jangka panjang memungkinkan virus untuk mengeksplorasi cara menginfeksi sel secara lebih efisien. Dan (studi ini) menambah bukti bahwa varian yang lebih mudah menular telah muncul dari infeksi semacam itu,"" terang ahli epidemiologi Universitas Harvard, William Hanage, yang dikutip dariScienceAlert. ""Oleh karena itu, menangani kasus-kasus seperti itu secara efektif merupakan prioritas bagi kesehatan individu dan masyarakat,"" sambungnya.   Analisis genetik Joseline Velasquez-Reyes, ahli bioinformatika Universitas Boston dan rekan-rekannya terhadap sampel virus yang dikumpulkan dari pasien antara Maret 2021 dan Juli 2022, mengungkapkan apa yang dilakukan virus tersebut selama invasi yang meluas. ""Hanya dalam satu orang, jenis mutasi yang sama yang menyebabkan munculnya varian Omicron yang berkembang biak lebih cepat sedang dalam proses pengulangan,"" jelas mereka. ""Hal ini mendukung teori bahwa perubahan mirip Omicron berkembang dari tekanan seleksi yang dialami virus di dalam tubuh kita.""    Pasien yang telah mengalami HIV-1 stadium lanjut ini yakin telah tertular SARS-CoV-2 pada pertengahan Mei 2020. Selama masa tersebut, ia tidak menerima terapi antiretroviral (ART). Ia juga tidak dapat mengakses perawatan medis yang diperlukan, meskipun mengalami gejala pernapasan, sakit kepala, nyeri badan, dan lemas. Pria berusia 41 tahun itu memiliki jumlah sel T pembantu imun hanya 35 sel per mikroliter darah, yang menjelaskan bagaimana virus tersebut dapat bertahan begitu lama. Kisaran normalnya adalah 500 hingga 1.500 sel per mikroliter. Untungnya, setidaknya dalam kasus ini virus COVID-19 yang membandel ini tidak terlalu menular. ""Tidak adanya infeksi lanjutan yang diduga terjadi mungkin mengindikasikan hilangnya kemampuan penularan selama adaptasi terhadap satu inang,"" beber Velasquez-Reyes dan tim yang dipublikasikan di The Lancet. Namun, tidak ada jaminan bahwa infeksi lain yang menetap dalam jangka panjang di dalam tubuh kita akan mengikuti jalur evolusi yang sama. Hal ini yang membuat para ahli waspada dan menyerukan pemantauan ketat COVID-19 yang berkelanjutan dan akses layanan kesehatan yang memadai bagi semua orang. ""Membersihkan infeksi ini harus menjadi prioritas bagi sistem layanan kesehatan,"" simpul para peneliti. Untuk mengurangi kemungkinan mutasi yang bermasalah, dokter dan peneliti mengimbau masyarakat untuk terus melakukan vaksinasi dan tetap menggunakan masker di area tertutup yang ramai. "
Strategi BPOM RI Berantas Produk Obat dan Makanan Mengandung Bahan Berbahaya;;https://health.detik.com/berita-detikhealth/d-8114838/strategi-bpom-ri-berantas-produk-obat-dan-makanan-mengandung-bahan-berbahaya;2025-09-16 09:22:49;Badan Pengawas Obat dan Makanan (BPOM RI) bergerak cepat untuk memberantas produk obat dan makanan mengandung bahan berbahaya.;"Badan Pengawas Obat dan Makanan (BPOM RI) bergerak cepat untuk memberantas produk obat dan makanan mengandung bahan berbahaya. BPOM berkomitmen untuk menyelesaikan permasalahan ini dari hulu ke hilir melalui Kick Off Aksi Bersama Pencegahan dan Penanganan Rantai Pasok Bahan Berbahaya/Bahan Dilarang Deputi Bidang Penindakan BPOM, Tubagus Ade Hidayat menyampaikan bahwa tren tindak pidana terkait obat dan makanan terus meningkat dalam 5 tahun terakhir. Pada 2024, PPNS BPOM menangani 282 perkara, terdiri dari 124 perkara obat dan NAPZA, 55 perkara obat bahan alam, 91 perkara kosmetik, dan 12 perkara pangan olahan. ""Sejumlah temuan menunjukkan nilai keekonomian yang signifikan, di antaranya perkara obat-obat tertentu di Semarang, Cikarang, dan Marunda senilai Rp 398 miliar, serta perkara kosmetik mengandung bahan berbahaya di beberapa kota dengan nilai Rp 5,5 miliar,"" kata Tubagus di Kantor BPOM, Jakarta Pusat, Senin (15/9/2025). ADVERTISEMENT SCROLL TO CONTINUE WITH CONTENT ""Fakta menarik, di berbagai lokasi kasus juga ditemukan bahan baku berbahaya seperti formalin, merkuri, tramadol, hingga hidrokinon,"" sambungnya. Kasus besar yang disorot antara lain temuan ratusan drum/tong berisi BKO di Semarang, Jawa Tengah serta Marunda dan Cikarang, Jawa Barat dengan nilai ekonomi Rp 389 miliar; OBA mengandung BKO di Klaten dan Kudus, Jawa Tengah senilai Rp3,74 miliar; kosmetik mengandung bahan berbahaya di Tangerang, Banten dan kota lainnya senilai Rp 5,5 miliar. Lalu pangan olahan berupa mi basah mengandung formalin di Pematang Siantar, Sumatera Utara senilai Rp 200 juta. Pada sebagian besar kasus tersebut, di samping produk jadi ditemukan bahan baku dilarang/bahan berbahaya.  Senada, Kepala BPOM RI Taruna Ikrar menegaskan pentingnya aksi bersama ini untuk melindungi kesehatan masyarakat sekaligus menjaga daya saing ekonomi nasional. Obat dan makanan adalah kebutuhan dasar yang harus aman dan bermutu. Pada 2025, potensi pasar obat dan makanan diperkirakan mencapai Rp 4.674 triliun dan menyumbang 8,7 persen PDB. ""Namun (perlindungan masyarakat) tantangannya besar, karena masih marak peredaran produk mengandung bahan berbahaya yang berisiko merusak organ, meningkatkan risiko kanker, hingga menyebabkan kematian,"" kata Taruna. ""Selama bahan berbahaya mudah didapatkan, penyalahgunaan dalam produksi masih sangat mungkin terjadi. Karena itu, kita harus bergerak bersama dari hulu dengan kolaborasi lintas sektor,"" lanjutnya.   Ikrar menegaskan bahwa pelanggar akan berhadapan dengan sanksi pidana jika ketahuan memakai bahan berbahaya atau yang dilarang untuk produksi farmasi dan pangan olahan. ""Kami tidak segan menindak tegas pelanggar dengan sanksi hukum pidana maupun administratif, agar muncul efek jera. Perlindungan kesehatan masyarakat sekaligus keberlangsungan industri nasional adalah prioritas utama kami,"" tegas Ikrar. ""Selama bahan berbahaya masih bebas beredar tidak sesuai ketentuan, maka selama itu juga kesehatan masyarakat akan terancam. Untuk itulah pencegahan dan penanganan rantai pasok bahan berbahaya dan bahan dilarang harus menjadi fokus utama,"" tutupnya. Aksi ini melibatkan Kementerian Perdagangan (Kemendag), Kementerian Komunikasi dan Digital (Komdigi), Direktorat Jenderal Bea dan Cukai Kementerian Keuangan, Kementerian Lingkungan Hidup, Bareskrim Polri, dan Pemerintah Provinsi Daerah Khusus Ibukota Jakarta serta asosiasi hingga pelaku usaha. Serta beberapa asosiasi dan pelaku usaha yang memiliki komitmen sama di antaranya Gabungan Perusahaan Farmasi Indonesia (GPFI), Indonesian E-Commerce Association (IdEA), PT Perusahaan Perdagangan Indonesia (PPI), Asosiasi Perusahaan Jasa Pengiriman Ekspres (ASPERINDO), serta Perkumpulan Perusahaan Pemeriksa Keamanan Kargo dan Pos Indonesia (PAPPKINDO). "
Curhat Pria Lahir dari Donor Sperma, Bingung Cari Ayah Kandung;;https://health.detik.com/berita-detikhealth/d-8114689/curhat-pria-lahir-dari-donor-sperma-bingung-cari-ayah-kandung;2025-09-16 08:22:52;Seorang pria di Inggris merupakan salah satu anak yang lahir dari donor sperma.;"Seorang pria di Inggris merupakan salah satu anak yang lahir dari donor sperma. Ia dikandung melalui program bayi tabung atau In Vitro Fertilization (IVF) dengan donor sperma para tahun 2002. Sampai di usia 18 tahun, pria bernama Nat Allbut itu mengajukan permohonan kepada Human Fertilisation and Embryology Authority (HFEA) atau otoritas fertilisasi dan embriologi manusia untuk mendapatkan informasi tentang orang tua kandungnya. Allbut menerima berkas berisi detail tentang donor spermanya, termasuk tinggi badan, warna mata, profesi, dan kewarganegaraan yang meyakini bahwa itu adalah ayah kandungnya. Tetapi, dua tahun kemudian, hasil tes DNA yang ia jalani bertentangan dengan detail dari HFEA. ADVERTISEMENT SCROLL TO CONTINUE WITH CONTENT ""Ada tahun-tahun dalam hidup saya, di mana saya yakin bahwa saya memiliki latar belakang yang sebenarnya keliru,"" tuturnya yang dikutip dariIndependent UK.   Kini, ia menjadi salah satu dari banyaknya orang yang lahir melalui donasi sperma. Hal itu yang membuat orang-orang seperti Allbut bisa mendapatkan informasi yang akurat tentang orang tua mereka. HFEA, otoritas yang mengatur donasi sperma dan IVF di Inggris, mengaku sedang menyelidiki lebih dari selusin kasus. Mereka mengatakan kurang dari 20 kasus kesalahan informasi ini bergantung pada kualitas data yang diserahkan klinik. ""Masalah ini mungkin terjadi pada sejumlah kecil klinik donor pada tahun 1990-an dan awal 2000-an,"" kata pihak HFEA. ""Ini adalah masalah historis yang sangat spesifik,"" tambahnya.    Laporan HFEA menunjukkan lebih dari 2.800 anak lahir melalui donor sperma pada tahun 2019 di Inggris. Donasi sel telur, sperma, dan embrio menyumbang satu dari 170 kelahiran dan satu dari enam kelahiran yang menggunakan IVF di negara tersebut. Setelah Allbut menemukan bahwa detail yang diterima dari HFEA tidak cocok dengan miliknya, ia dicocokkan dengan beberapa kerabat dekat di situs DNA komersial lainnya. Di antara mereka, terdapat seorang yang terdaftar sebagai saudara tiri, yang menerima berkas dari HFEA yang menjelaskan siapa orang yang diduga sebagai ayah donornya. ""Saya menemukan daftar informasi yang sama sekali berbeda di Ancestry, yang tidak masuk akal karena tidak sesuai dengan berkas asli yang saya terima,"" beber Allbut. Namun, regulator awalnya mengklaim bahwa mereka tidak menemukan kesalahan apapun dalam informasi yang diberikan kepada Allbut. Tetapi, Allbut merasa mereka perlu bertanggung jawab atas apa yang terjadi. ""Saya pikir setidaknya mereka bisa mengakui bahwa mereka telah melakukan kesalahan dan memperbaikinya. Bukan hanya saya, orang lain juga telah menerima informasi yang salah,"" terang Allbut. Kepala Eksekutif HFEA, Peter Thompson, mengatakan ia ingin meminta maaf kepada Allbut atas nama pihaknya. Melalui pernyataan tertulis, HFEA mengaku menyesal atas ketidaknyamanan yang disebabkan karena informasi yang mereka berikan tidak sesuai dengan hasil tes DNA. "
Pastikan Indomie Aman, Indofood Soroti Beda Regulasi RI Vs Taiwan soal Etilen Oksida;;https://health.detik.com/berita-detikhealth/d-8114504/pastikan-indomie-aman-indofood-soroti-beda-regulasi-ri-vs-taiwan-soal-etilen-oksida;2025-09-16 06:22:54;Laporan kandungan etilen oksida (EtO) dalam Indomie varian Soto Banjar Limau Kuit belakangan memicu kekhawatiran publik.;"Laporan kandungan etilen oksida (EtO) dalam Indomie varian Soto Banjar Limau Kuit belakangan memicu kekhawatiran publik. Temuan tersebut dilaporkan otoritas Taiwan yang tidak mentolerir kandungan EtO dalam setiap pangan alias wajib nol terdeteksi, karena risiko masalah saraf hingga pemicu kanker dalam batas kadar tertentu. Corporate Secretary PT Indofood CBP Sukses Makmur Gideon A Putro menekankan pihaknya secara resmi tidak pernah mengimpor langsung varian tersebut ke Taiwan. ""Varian tersebut diimpor oleh importir yang bukan merupakan distributor resmi Perseroan, mengingat sampai dengan saat ini varian tersebut tidak dipasarkan di atau diekspor ke Taiwan,"" tegas Gideon dalam keterangannya di keterbukaan infomasi Bursa Efek Indonesia, dikutip Selasa (16/9/2025). ADVERTISEMENT SCROLL TO CONTINUE WITH CONTENT  Soroti Beda Regulasi RI Vs Taiwan Indomie bukan kali pertama tersandung kasus etilen oksida. Pihak produsen menyoroti adanya perbedaan persyaratan perizinan dan ketentuan keamanan pangan di RI dengan negara lain. Produk Indomie dinyatakan aman digunakan lantaran sudah memenuhi syarat izin Badan Pengawas Obat dan Makanan Republik Indonesia (""BPOM RI"") dan Codex Standard for Instant Noodles, yang juga telah mengantongi Sertifikasi Standar Nasional Indonesia (SNI).   ""Sedangkan persyaratan, peraturan dan ketentuan keamanan pangan di negara tujuan ekspor dapat berbeda dengan persyaratan, peraturan dan ketentuan keamanan pangan di Indonesia, yang juga senantiasa dipenuhi oleh perseroan untuk masing-masing negara tujuan ekspor termasuk Taiwan,"" lanjutnya. Pihaknya disebut akan terus berkoordinasi dengan BPOM RI dan otoritas Taiwan untuk tindak lanjut perkembangan kasus temuan etilen oksida yang dikhawatirkan memicu kanker dan gangguan saraf. Konsumen disebutnya tidak perlu khawatir, mengingat Indomie selama ini juga sudah dipasarkan lebih dari 30 tahun dan nihil masalah. ""Kejadian tersebut juga tidak memberikan dampak material pada kegiatan operasional maupun kinerja keuangan perseroan,"" tutup Gideon. "
Ilmuwan Jepang Temukan Cara Hapus Ingatan, Harapan Baru Mengobati Trauma;;https://health.detik.com/berita-detikhealth/d-8114224/ilmuwan-jepang-temukan-cara-hapus-ingatan-harapan-baru-mengobati-trauma;2025-09-16 04:22:57;Otak memiliki kemampuan luar biasa untuk menyimpan informasi sebagai ingatan, memungkinkan kita belajar dari kesalahan.;"Otak memiliki kemampuan luar biasa untuk menyimpan informasi sebagai ingatan, memungkinkan kita belajar dari kesalahan. Namun, tidak semua ingatan memiliki kekuatan yang sama; beberapa tetap jelas, sementara yang lain memudar. Para peneliti di Tohoku University kini menemukan bahwa sebagian dari proses seleksi ingatan ini bergantung pada fungsi astrosit, sejenis sel khusus yang mengelilingi neuron di otak. Mereka menunjukkan bahwa memanipulasi astrosit secara artifisial dapat mencegah ingatan tersimpan dalam jangka panjang, membuka wawasan baru tentang cara otak kita memproses dan menyimpan informasi. ADVERTISEMENT SCROLL TO CONTINUE WITH CONTENT Percobaan dengan Bantuan Optogenetika Dikutip dari laman Tohoku University, untuk memanipulasi astrosit, para peneliti menggunakan teknik yang disebut optogenetika pada otak tikus. Dengan menyinari sel-sel tersebut melalui serat optik, mereka bisa secara langsung merangsang dan membuat astrosit menjadi lebih asam atau lebih basa. Penelitian ini difokuskan pada astrosit di amigdala, area otak yang dikenal penting dalam mengatur emosi dan rasa takut. Dalam satu percobaan, tikus diberi kejutan listrik ringan. Ketika kembali ke ruangan yang sama, tikus itu membeku, sebagai respons alami terhadap ingatan akan kejutan. Namun, tikus yang astrositnya dibuat lebih asam segera setelah kejutan, hanya mengingat rasa takut itu untuk sementara waktu dan melupakannya keesokan harinya. Ini menunjukkan bahwa asam astrosit tidak memengaruhi memori jangka pendek, tetapi mencegahnya menjadi memori jangka panjang.   Harapan baru mengobati trauma Efek yang berbeda terlihat pada tikus yang astrositnya dibuat lebih basa. Tiga minggu kemudian, tikus kontrol biasanya menunjukkan tanda-tanda lupa, dengan respons membeku yang menurun. Namun, tikus yang astrositnya dibuat lebih basa setelah kejutan yang kuat, tetap menunjukkan respons takut yang kuat bahkan setelah tiga minggu. Penemuan ini menunjukkan bahwa astrosit memainkan peran kunci dalam menentukan apakah ingatan akan terhapus atau dipertahankan untuk waktu yang lama, terutama setelah kejadian traumatis. Hal ini menantang pemahaman umum bahwa memori jangka pendek secara bertahap mengeras menjadi memori jangka panjang. ""Kami percaya ini bisa mengubah cara kita memahami pembentukan memori,"" kata Profesor Ko Matsui, pemimpin penelitian. Peneliti utama, Hiroki Yamao, percaya bahwa astrosit dapat menjadi kunci untuk memahami perubahan emosional dan pembentukan memori. ""Ini mungkin hanya sekilas tentang bagaimana astrosit memengaruhi pemrosesan informasi emosional,"" jelas Yamao. ""Tujuan kami selanjutnya adalah mengungkap mekanisme astrosit dalam mengatur memori emosional."" Memahami proses-proses ini dapat membuka jalan bagi terapi yang mencegah terbentuknya ingatan traumatis. Ini menawarkan pendekatan yang sangat berharga untuk mengobati gangguan seperti gangguan stres pascatrauma (PTSD) dengan mengintervensi pembentukan memori itu sendiri. "
Mengenal Golongan Darah Paling Langka di Dunia, Ada yang Dijuluki 'Golden Blood Type';;https://health.detik.com/berita-detikhealth/d-8113591/mengenal-golongan-darah-paling-langka-di-dunia-ada-yang-dijuluki-golden-blood-type;2025-09-16 04:22:59;Golongan darah emas (Golden blood type), atau Rh null, merupakan golongan darah paling langka di dunia karena sama sekali tidak memiliki antigen Rh pada sel darah merah.;Golongan darah emas (Golden blood type), atau Rh null, merupakan golongan darah paling langka di dunia karena sama sekali tidak memiliki antigen Rh pada sel darah merah. Jumlah orang dengan golongan darah ini diperkirakan kurang dari 50 individu di seluruh dunia. Golongan darah emas pertama kali ditemukan pada seorang perempuan Aborigin Australia pada tahun 1961. Sel darah merah manusia memiliki gula dan protein yang disebut antigen pada permukaannya. Kombinasi antigen inilah yang menentukan golongan darah, yang terbagi ke dalam sistem ABO: A, B, AB, atau O. Selain itu, ada faktor Rhesus (Rh) yang dibedakan menjadi positif (+) atau negatif (-), tergantung ada atau tidaknya antigen Rh-D pada sel darah merah. Dikutip dari Medicinenet, orang dengan golongan darah Rh negatif hanya tidak memiliki antigen Rh-D, sedangkan orang dengan golongan darah emas (Rh null) benar-benar tidak memiliki satupun antigen Rh. ADVERTISEMENT SCROLL TO CONTINUE WITH CONTENT Masalah utama dari golongan darah emas adalah sulitnya mendapatkan donor. Orang dengan Rh null hanya bisa mengandalkan jaringan kecil donor tetap di seluruh dunia jika mereka membutuhkan transfusi darah. Saat ini, tercatat hanya ada sekitar sembilan donor aktif dengan golongan darah ini. Karena itu, Rh null dijuluki sebagai golongan darah paling berharga di dunia, atau golden blood. Golongan darah emas diyakini muncul akibat mutasi genetik, khususnya pada gen RHAG, yaitu gen yang mengkode Rh-associated glycoprotein. Protein ini berfungsi mengarahkan antigen Rh agar menempel pada membran sel darah merah. Mutasi RHAG sering dikaitkan dengan penyakit hereditary stomatocytosis, yaitu kondisi kelainan darah yang ditandai dengan anemia hemolitik ringan jangka panjang akibat sel darah merah lebih cepat rusak. Fenotipe Rh null juga dapat muncul pada beberapa jenis anemia bawaan. Beberapa kondisi yang dapat meningkatkan risiko seseorang memiliki golongan darah emas antara lain: Golongan darah emas bisa didonorkan. Karena sama sekali tidak memiliki antigen pada sel darah merah, pemilik Rh null dianggap sebagai donor universal untuk orang dengan berbagai golongan darah langka dalam sistem Rh. Darah ini sangat berharga dalam transfusi karena tidak memicu reaksi penolakan, sehingga aman diberikan kepada banyak penerima. Namun, karena kelangkaannya, sangat sulit menemukan darah jenis ini. Sebaliknya, bagi pemilik golongan darah emas sendiri, kondisi ini justru berisiko. Jika suatu saat mereka membutuhkan transfusi, menerima darah yang mengandung antigen Rh bisa memicu reaksi transfusi yang berbahaya. Orang dengan golongan darah Rh null atau darah emas dapat mengalami beberapa masalah kesehatan, di antaranya: Mereka cenderung mengalami anemia hemolitik ringan hingga sedang akibat penghancuran sel darah merah lebih cepat dari biasanya. Hal ini dapat menyebabkan kadar hemoglobin rendah, kulit pucat, dan mudah lelah. Kondisi ini dipicu oleh kelainan struktur sel darah merah, seperti: Pemilik darah emas menghadapi kesulitan besar ketika membutuhkan transfusi. Jika darah mereka terpapar antigen Rh dari darah donor, tubuh dapat dengan cepat membentuk autoantibodi, yang berisiko memicu reaksi transfusi berat. Karena itu, rumah sakit harus memiliki protokol khusus dan penanganan cepat bagi pasien dengan golongan darah ini. Jika ibu bergolongan Rh null mengandung bayi dengan Rh positif, dan darah ibu terpapar darah bayi, tubuh ibu dapat membentuk antibodi. Antibodi ini bisa menyerang kehamilan berikutnya atau bahkan memicu keguguran. Sejumlah penelitian menemukan bahwa infeksi atau sepsis pada individu dengan Rh null dapat memicu hemolisis masif (penghancuran besar-besaran sel darah merah), yang kemudian dapat menyebabkan gagal ginjal dan komplikasi serius lainnya. Selain golongan 'darah emas' atau Rh-null, ada lagi golongan darah yang dianggap langka di dunia. Berikut penjelasannya. Golongan darah emas atau Rh-null adalah yang paling langka di dunia, dengan jumlah kasus tercatat kurang dari 50 orang. Rh-null berarti seseorang sama sekali tidak memiliki 61 jenis antigen yang biasanya ada pada sel darah merah. Karena tidak memiliki antigen sama sekali, Rh-null bisa didonorkan ke banyak golongan darah langka lain yang berbeda jauh dari delapan golongan darah utama. Namun, pemilik Rh-null hanya bisa menerima darah dari sesama Rh-null. Kelangkaan darah ini, ditambah sifat uniknya, membuatnya sangat berharga dalam dunia medis dan riset ilmiah, sehingga disebut sebagai golden blood. AB− adalah golongan darah paling langka dari delapan tipe dasar ABO, hanya mencakup kurang dari 1 persen populasi dunia. Di Amerika Serikat, hanya sekitar 1 dari 167 orang yang memiliki golongan darah ini. Pemilik AB− dapat menerima darah dari semua golongan Rh negatif (A−, B−, AB−, dan O−), namun hanya bisa mendonorkan darah ke orang dengan golongan AB, baik Rh positif maupun negatif. Karena memiliki antigen A dan B, AB− kompatibel dengan semua golongan darah Rh negatif utama. Selain itu, AB adalah donor plasma universal, sehingga plasma darahnya dapat diberikan kepada siapa pun, dari golongan darah apa pun. Golongan darah HH, juga dikenal sebagai Bombay blood group, merupakan tipe yang sangat langka. Diperkirakan hanya sekitar 4 dari setiap 1 juta orang di dunia yang memilikinya, dengan prevalensi lebih tinggi di India (sekitar 1 dari 10.000 orang di Bombay). Hingga kini, tercatat sekitar 179 orang di India memiliki golongan darah ini. Meskipun secara serologi terlihat seperti O−, golongan darah Bombay tidak memiliki antigen H, yaitu komponen penting dalam sistem ABO. Ketiadaan antigen H ini yang disebut sebagai Bombay phenotype. Pemilik golongan darah Bombay dapat mendonorkan darahnya ke orang dengan golongan ABO tertentu, tetapi mereka sendiri hanya bisa menerima darah dari sesama HH.
