title;tag;link;date;description;content
Mayapada Hospital Hadirkan 3 Solusi Olahraga Terpadu agar Lebih Sehat;;https://health.detik.com/berita-detikhealth/d-8110563/mayapada-hospital-hadirkan-3-solusi-olahraga-terpadu-agar-lebih-sehat;Sabtu, 13 Sep 2025 19:03;Mayapada Hospital Bandung, salah satu unit rumah sakit di bawah naungan PT Sejahteraraya Anugerahjaya Tbk (SRAJ), terus meningkatkan mutu dan kualitas layanan unggulannya (center of excellence) melalui layanan Sports Injury Treatment & Performance Center (SITPEC) yang komprehensif.;"Mayapada Hospital Bandung, salah satu unit rumah sakit di bawah naungan PT Sejahteraraya Anugerahjaya Tbk (SRAJ), terus meningkatkan mutu dan kualitas layanan unggulannya (center of excellence) melalui layanan Sports Injury Treatment & Performance Center (SITPEC) yang komprehensif. Layanan terpadu khusus kesehatan dan kebugaran ini menjawab kebutuhan masyarakat dari berbagai latar belakang. Mulai dari sport enthusiast dan atlet hingga pasien dengan penyakit metabolik akibat gaya hidup (lifestyle disease) yang tetap ingin berolahraga dengan aman. Hospital Director Mayapada Hospital Bandung, dr. Irwan Susanto Hermawan, MM mengatakan pihaknya berkomitmen menghadirkan layanan kesehatan modern. Ia menyebut layanan tersebut dirancang untuk menjawab tuntutan produktivitas tinggi yang berpengaruh pada kesehatan dan kebugaran. ADVERTISEMENT SCROLL TO CONTINUE WITH CONTENT ""Melalui kelengkapan layanan dan tim dokter multidisiplin yang ada di Sport Injury Treatment and Performance Center, kami memberikan pendampingan menyeluruh dan personal, mulai dari pencegahan dan pemulihan cedera, peningkatan performa olahraga, hingga pendampingan pola hidup sehat bagi penderita penyakit metabolik agar tetap bisa berolahraga secara aman dan terarah. Kami percaya, hidup sehat adalah kunci kebahagiaan, kesejahteraan, dan kualitas hidup yang lebih baik, dan komitmen ini kami hadirkan khusus bagi masyarakat Bandung dan Jawa Barat,"" ujar dr. Irwan dalam keterangannya, Sabtu (13/9/2025). SITPEC Mayapada Hospital Bandung menghadirkan tiga program utama, yakni Medical Fitness Program yang memungkinkan pasien kronis tetap dapat berolahraga aman di bawah pengawasan medis, Program Peningkatan Performa Fisik untuk membantu atlet maupun sport enthusiast mencapai kebugaran optimal dengan latihan terarah. Adapun Program Penanganan dan Pemulihan Pasca Cedera Olahraga dengan tindakan berbasis minimal invasif (artroskopi) hingga program yang mendukung rehabilitasi agar pasien dapat kembali berolahraga (return to sport) dan untuk atlet dapat kembali berkompetisi (return to competition). Sebagai layanan komprehensif dan terintegrasi, SITPEC Mayapada Hospital Bandung melibatkan tim dokter multidisiplin dari Dokter Spesialis Kedokteran Olahraga, Orthopedi dan Traumatologi, Kedokteran Fisik dan Rehabilitasi, Gizi Klinik, Jantung dan Pembuluh Darah, Penyakit Dalam, serta Fisioterapis Olahraga. Didukung fasilitas modern seperti Gym, VO₂ Max Test, dan Body Composition Analysis, SITPEC mampu memberikan program latihan yang personal, aman, dan sesuai kondisi dan kebutuhan setiap pasien. Dokter Spesialis Kedokteran Olahraga Mayapada Hospital Bandung, dr. Alvin Wiharja, Sp.KO, M.M.R.S, mengatakan pentingnya olahraga sebagai terapi bagi pasien dengan penyakit metabolik seperti diabetes, hipertensi, atau jantung. Dengan fasilitas modern di SITPEC, ia memastikan penilaian kondisi fisik menyeluruh sehingga program latihan dan pola makan dapat dirancang lebih personal, efektif, dan aman.  ""Olahraga adalah terapi penting, bahkan untuk pasien dengan penyakit metabolik seperti diabetes, hipertensi, atau jantung yang tetap memerlukan olahraga dengan aman untuk membantu mengontrol gula darah, menurunkan tekanan darah, dan memperbaiki profil kolesterol. Dengan fasilitas lengkap, modern, dan nyaman di SITPEC Mayapada Hospital Bandung, kami bisa menilai kondisi fisik secara menyeluruh, sehingga program latihan dan pola makan dapat dirancang lebih tepat, personal, dan efektif untuk mendukung kesehatan jangka panjang,"" ungkap dr. Alvin. Sebelumnya, layanan SITPEC Mayapada Hospital Bandung telah hadir dan aktif melayani masyarakat Bandung serta Jawa Barat, termasuk berbagai komunitas olahraga yang memanfaatkan fasilitas ini untuk menjaga kebugaran dan pemulihan cedera. Saat ini, masyarakat sekitar juga dapat menikmati harga khusus pemeriksaan VO2 Max di SITPEC Mayapada Hospital Bandung, sebagai bagian dari komitmen rumah sakit dalam mendukung masyarakat Jawa Barat yang lebih sehat. Selain di Mayapada Hospital Bandung, layanan SITPEC juga hadir di unit Mayapada Hospital lainnya, yakni di Jakarta Selatan (Lebak Bulus dan Kuningan) serta Tangerang. "
Bisa Jawab 10 Tebak-tebakan Ini? Tandanya Kamu Super Kreatif;;https://health.detik.com/berita-detikhealth/d-8110562/bisa-jawab-10-tebak-tebakan-ini-tandanya-kamu-super-kreatif;Sabtu, 13 Sep 2025 19:02;Pernah merasa tertantang saat mencoba menjawab tebak-tebakan yang bikin otak berpikir keras untuk mencari jawabannya? Soal tebak-tebakan asah otak memang bisa melatih konsentrasi, logika, dan kreativitas.;Pernah merasa tertantang saat mencoba menjawab tebak-tebakan yang bikin otak berpikir keras untuk mencari jawabannya? Soal tebak-tebakan asah otak memang bisa melatih konsentrasi, logika, dan kreativitas. Tak heran jika permainan ringan ini banyak dilakukan untuk mengisi waktu luang bersama teman atau keluarga. Ingin mencobanya? Siap uji ketajaman otak? Coba pecahkan tebak-tebakan ini. Cuma yang jeli yang bisa jawab. ADVERTISEMENT SCROLL TO CONTINUE WITH CONTENT 1. Saya Kemana-mana memakai sepatu, tidak pernah dilepas setiap waktu, bahkan saat tidur. Siapakah saya?2. Saya pembunuh mematikan. Tidak pernah sakit, tapi selalu diberi obat. Air adalah kampung halaman saya. Siapakah saya?3. Saya dibuang saat dibutuhkan dan dipungut saat tidak dibutuhkan. Coba tebak, siapa saya?     Bisa menjawab semua soal tebak-tebakan asah otak? Coba cocokkan dengan jawaban berikut. 1. Kuda2. Nyamuk3. Jangkar4. Semangka5. Tersisa 3 telur. Sebab, telur yang dipecahkan, digoreng dan dimakan hanya 3 butir  
Jalan Kaki Bisa Turunkan Kolesterol Tinggi, Pakar Beberkan Caranya;;https://health.detik.com/berita-detikhealth/d-8110499/jalan-kaki-bisa-turunkan-kolesterol-tinggi-pakar-beberkan-caranya;Sabtu, 13 Sep 2025 18:00;Banyak orang ingin menurunkan kolesterol dan melindungi kesehatan jantung, tetapi jarang sekali berolahraga.;"Banyak orang ingin menurunkan kolesterol dan melindungi kesehatan jantung, tetapi jarang sekali berolahraga. Untuk meningkatkan kadar lemak darah (LDL, HDL, trigliserida) dan membantu sistem kardiovaskular, para ahli menyarankan untuk berjalan kaki setiap hari. Ahli jantung intervensi Dr Bradley Serwer menjelaskan kolesterol tinggi merupakan faktor risiko utama yang dapat memicu penyakit arteri koroner. Dengan mengelola kadar kolesterol dapat membantu menghindari atau mengurangi serangan jantung, stroke, dan penyakit pembuluh darah perifer. Trigliserida merupakan bahaya lain, sebab dapat meningkat sendiri atau bersamaan dengan kolesterol. Hal ini dapat meningkatkan risiko seseorang mengalami penyakit jantung. ADVERTISEMENT SCROLL TO CONTINUE WITH CONTENT Dikutip dari Economic Times, berjalan kaki dapat menurunkan kolesterol jahat atau LDL, yang merupakan lemak lilin yang menumpuk di arteri. Ahli jantung dan profesor kedokteran di Icahn School of Medicine, Mount Sinai, memperingatkan bahwa LDL tinggi meningkatkan risiko stroke dan serangan jantung dengan membentuk plak di pembuluh darah vital. Penelitian menemukan wanita dengan kelebihan berat badan atau obesitas yang berjalan kaki selama 4 minggu menurunkan kolesterol total dan LDL sekitar 7 mg/dL. Sementara, pria yang melakukan olahraga sedang selama 12 minggu mengalami penurunan LDL sebesar 5-7 persen. Studi pada orang dewasa berusia 40-65 tahun yang berjalan kaki selama lebih dari tiga bulan menunjukkan hasil yang beragam. Beberapa mengalami perubahan kolesterol atau trigliserida, dan beberapa lainnya tidak.  Berjalan kaki mendukung kolesterol baik atau HDL, yang membersihkan kolesterol dari arteri, mencegah oksidasi berbahaya, mengurangi peradangan, dan dapat menurunkan risiko pembekuan darah. HDL yang lebih tinggi biasanya berarti memiliki risiko jantung yang lebih rendah. Dr Serwer mengatakan olahraga aerobik, seperti berjalan kaki, tidak hanya meningkatkan HDL tetapi juga meningkatkan pematangan dan kerja partikel HDL. Lemak ini bersirkulasi dalam darah, yang jika terlalu banyak meningkatkan risiko kardiovaskular. Berjalan kaki dapat membantu karena otot membakar trigliserida sebagai energi selama berolahraga. Studi menghubungkan berjalan kaki secara teratur dengan penurunan kadar trigliserida. Seberapa Banyak Langkah yang Perlu Dilakukan? Berdasarkan pedoman Pusat Pengendalian dan Pencegahan Penyakit (CDC), merekomendasikan 150 menit olahraga sedang per minggu. Itu sekitar 30 menit per hari yang dilakukan selama lima hari. Jalan cepat dengan kecepatan 3-4 mph juga penting. Berjalan kaki lebih banyak, sekitar 300 menit per minggu dapat memberikan manfaat yang lebih besar bagi jantung. Menurut Dr Rozanski, berjalan kaki dalam waktu singkat sekitar lima menit per hari dapat meningkatkan kesehatan.   Cobalah berjalan kaki 10-15 menit setelah makan. Ini membantu metabolisme lipid dan pemrosesan kolesterol.Selanjutnya, cobalah berjalan agak menanjak atau memberikan beban tangan untuk mengaktifkan lebih banyak otot dan membakar lebih banyak lemak. Padukan jalan kaki dengan makanan penurun kolesterol. Misalnya seperti mengonsumsi oatmeal untuk sarapan dan camilan biji-bijian atau kacang-kacangan setelah jalan kaki. Para ahli menekankan bahwa perubahan kecil yang dilakukan setiap hari dapat memberikan manfaat besar bagi jantung seiring waktu. Mulailah dengan 10 menit sehari saja dapat meningkatkan kesehatan tubuh dan pikiran. ""Jantung Anda tidak peduli seberapa cepat Anda bergerak, yang penting Anda terus bergerak,"" tegas para ahli. Semakin awal memulai berjalan kaki setiap hari, semakin cepat pula manfaatnya bagi jantung dan tubuh. "
Klaim BPJS Kesehatan untuk Gangguan Jiwa Naik! Hampir Rp 2 Triliun, Ini Rinciannya;;https://health.detik.com/berita-detikhealth/d-8115094/klaim-bpjs-kesehatan-untuk-gangguan-jiwa-naik-hampir-rp-2-triliun-ini-rinciannya;2025-09-16 10:24:54;Direktur Utama BPJS Kesehatan Ali Ghufron Mukti mengungkapkan bahwa nilai klaim program Jaminan Kesehatan Nasional (JKN) untuk masalah kesehatan mental mencapai Rp 6 triliun lebih.;"Direktur Utama BPJS Kesehatan Ali Ghufron Mukti mengungkapkan bahwa nilai klaim program Jaminan Kesehatan Nasional (JKN) untuk masalah kesehatan mental mencapai Rp 6 triliun lebih. Jumlah tersebut berdasarkan data nilai pengeluaran total periode tahun 2020-2024. Ghufron menyebut jumlah biaya yang dikeluarkan untuk menangani masalah kesehatan mental naik setiap tahun. ""Biayanya dalam waktu 2020-2024, sekitar Rp 6,7 triliun. Biaya untuk merawat yang sudah dibayar oleh BPJS untuk perawatan orang dengan gangguan jiwa (ODGJ),"" kata Ghufron ketika ditemui awak media di Surakarta, Jawa Tengah, Selasa (16/9/2025). ADVERTISEMENT SCROLL TO CONTINUE WITH CONTENT Untuk tahun 2024, biaya yang dikeluarkan oleh BPJS Kesehatan mencapai Rp 1,9 triliun. Jumlah itu meningkat dari tahun 2023 dengan Rp 1,6 triliun, tahun 2022 dengan Rp 1,2 triliun, tahun 2021 dengan Rp 1 triliun, dan tahun 2020 dengan Rp 937 miliar.   ""Yang menarik tahun 2024 itu, sudah hampir Rp 2 triliun biayanya, kasusnya meningkat. Kalau kita lihat dari 2,6 juta (klaim kasus) tahun 2020 ini meningkat terus sampai 5.186.418 kasus tahun 2024. Ini luar biasa,"" tandasnya. Berdasarkan jenis penyakit, berikut ini sederet masalah kesehatan mental dengan nilai pembiayaan BPJS Kesehatan tertinggi: "
Catat Rekor Baru, Pria Ini Positif COVID-19 Selama 2 Tahun!;;https://health.detik.com/berita-detikhealth/d-8114957/catat-rekor-baru-pria-ini-positif-covid-19-selama-2-tahun;2025-09-16 09:24:56;Seorang pria dengan sistem kekebalan tubuh yang lemah mengidap COVID-19 akut yang berkelanjutan selama lebih dari 750 hari.;"Seorang pria dengan sistem kekebalan tubuh yang lemah mengidap COVID-19 akut yang berkelanjutan selama lebih dari 750 hari. Selama periode ini, ia mengalami gejala pernapasan yang persisten dan dirawat di rumah sakit sebanyak lima kali. Meski durasinya panjang, kondisi pria ini berbeda dengan long COVID. Sebab, gejalanya bukanlah gejala yang menetap setelah virus menghilang, melainkan fase virus SARS-CoV-2 yang berlanjut selama lebih dari dua tahun. Kondisi ini mungkin hanya terjadi pada orang yang rentan. Tetapi, para ahli di Amerika Serikat memperingatkan dalam studi baru mereka. ADVERTISEMENT SCROLL TO CONTINUE WITH CONTENT ""Infeksi jangka panjang memungkinkan virus untuk mengeksplorasi cara menginfeksi sel secara lebih efisien. Dan (studi ini) menambah bukti bahwa varian yang lebih mudah menular telah muncul dari infeksi semacam itu,"" terang ahli epidemiologi Universitas Harvard, William Hanage, yang dikutip dariScienceAlert. ""Oleh karena itu, menangani kasus-kasus seperti itu secara efektif merupakan prioritas bagi kesehatan individu dan masyarakat,"" sambungnya.   Analisis genetik Joseline Velasquez-Reyes, ahli bioinformatika Universitas Boston dan rekan-rekannya terhadap sampel virus yang dikumpulkan dari pasien antara Maret 2021 dan Juli 2022, mengungkapkan apa yang dilakukan virus tersebut selama invasi yang meluas. ""Hanya dalam satu orang, jenis mutasi yang sama yang menyebabkan munculnya varian Omicron yang berkembang biak lebih cepat sedang dalam proses pengulangan,"" jelas mereka. ""Hal ini mendukung teori bahwa perubahan mirip Omicron berkembang dari tekanan seleksi yang dialami virus di dalam tubuh kita.""    Pasien yang telah mengalami HIV-1 stadium lanjut ini yakin telah tertular SARS-CoV-2 pada pertengahan Mei 2020. Selama masa tersebut, ia tidak menerima terapi antiretroviral (ART). Ia juga tidak dapat mengakses perawatan medis yang diperlukan, meskipun mengalami gejala pernapasan, sakit kepala, nyeri badan, dan lemas. Pria berusia 41 tahun itu memiliki jumlah sel T pembantu imun hanya 35 sel per mikroliter darah, yang menjelaskan bagaimana virus tersebut dapat bertahan begitu lama. Kisaran normalnya adalah 500 hingga 1.500 sel per mikroliter. Untungnya, setidaknya dalam kasus ini virus COVID-19 yang membandel ini tidak terlalu menular. ""Tidak adanya infeksi lanjutan yang diduga terjadi mungkin mengindikasikan hilangnya kemampuan penularan selama adaptasi terhadap satu inang,"" beber Velasquez-Reyes dan tim yang dipublikasikan di The Lancet. Namun, tidak ada jaminan bahwa infeksi lain yang menetap dalam jangka panjang di dalam tubuh kita akan mengikuti jalur evolusi yang sama. Hal ini yang membuat para ahli waspada dan menyerukan pemantauan ketat COVID-19 yang berkelanjutan dan akses layanan kesehatan yang memadai bagi semua orang. ""Membersihkan infeksi ini harus menjadi prioritas bagi sistem layanan kesehatan,"" simpul para peneliti. Untuk mengurangi kemungkinan mutasi yang bermasalah, dokter dan peneliti mengimbau masyarakat untuk terus melakukan vaksinasi dan tetap menggunakan masker di area tertutup yang ramai. "
Strategi BPOM RI Berantas Produk Obat dan Makanan Mengandung Bahan Berbahaya;;https://health.detik.com/berita-detikhealth/d-8114838/strategi-bpom-ri-berantas-produk-obat-dan-makanan-mengandung-bahan-berbahaya;2025-09-16 09:24:59;Badan Pengawas Obat dan Makanan (BPOM RI) bergerak cepat untuk memberantas produk obat dan makanan mengandung bahan berbahaya.;"Badan Pengawas Obat dan Makanan (BPOM RI) bergerak cepat untuk memberantas produk obat dan makanan mengandung bahan berbahaya. BPOM berkomitmen untuk menyelesaikan permasalahan ini dari hulu ke hilir melalui Kick Off Aksi Bersama Pencegahan dan Penanganan Rantai Pasok Bahan Berbahaya/Bahan Dilarang Deputi Bidang Penindakan BPOM, Tubagus Ade Hidayat menyampaikan bahwa tren tindak pidana terkait obat dan makanan terus meningkat dalam 5 tahun terakhir. Pada 2024, PPNS BPOM menangani 282 perkara, terdiri dari 124 perkara obat dan NAPZA, 55 perkara obat bahan alam, 91 perkara kosmetik, dan 12 perkara pangan olahan. ""Sejumlah temuan menunjukkan nilai keekonomian yang signifikan, di antaranya perkara obat-obat tertentu di Semarang, Cikarang, dan Marunda senilai Rp 398 miliar, serta perkara kosmetik mengandung bahan berbahaya di beberapa kota dengan nilai Rp 5,5 miliar,"" kata Tubagus di Kantor BPOM, Jakarta Pusat, Senin (15/9/2025). ADVERTISEMENT SCROLL TO CONTINUE WITH CONTENT ""Fakta menarik, di berbagai lokasi kasus juga ditemukan bahan baku berbahaya seperti formalin, merkuri, tramadol, hingga hidrokinon,"" sambungnya. Kasus besar yang disorot antara lain temuan ratusan drum/tong berisi BKO di Semarang, Jawa Tengah serta Marunda dan Cikarang, Jawa Barat dengan nilai ekonomi Rp 389 miliar; OBA mengandung BKO di Klaten dan Kudus, Jawa Tengah senilai Rp3,74 miliar; kosmetik mengandung bahan berbahaya di Tangerang, Banten dan kota lainnya senilai Rp 5,5 miliar. Lalu pangan olahan berupa mi basah mengandung formalin di Pematang Siantar, Sumatera Utara senilai Rp 200 juta. Pada sebagian besar kasus tersebut, di samping produk jadi ditemukan bahan baku dilarang/bahan berbahaya.  Senada, Kepala BPOM RI Taruna Ikrar menegaskan pentingnya aksi bersama ini untuk melindungi kesehatan masyarakat sekaligus menjaga daya saing ekonomi nasional. Obat dan makanan adalah kebutuhan dasar yang harus aman dan bermutu. Pada 2025, potensi pasar obat dan makanan diperkirakan mencapai Rp 4.674 triliun dan menyumbang 8,7 persen PDB. ""Namun (perlindungan masyarakat) tantangannya besar, karena masih marak peredaran produk mengandung bahan berbahaya yang berisiko merusak organ, meningkatkan risiko kanker, hingga menyebabkan kematian,"" kata Taruna. ""Selama bahan berbahaya mudah didapatkan, penyalahgunaan dalam produksi masih sangat mungkin terjadi. Karena itu, kita harus bergerak bersama dari hulu dengan kolaborasi lintas sektor,"" lanjutnya.   Ikrar menegaskan bahwa pelanggar akan berhadapan dengan sanksi pidana jika ketahuan memakai bahan berbahaya atau yang dilarang untuk produksi farmasi dan pangan olahan. ""Kami tidak segan menindak tegas pelanggar dengan sanksi hukum pidana maupun administratif, agar muncul efek jera. Perlindungan kesehatan masyarakat sekaligus keberlangsungan industri nasional adalah prioritas utama kami,"" tegas Ikrar. ""Selama bahan berbahaya masih bebas beredar tidak sesuai ketentuan, maka selama itu juga kesehatan masyarakat akan terancam. Untuk itulah pencegahan dan penanganan rantai pasok bahan berbahaya dan bahan dilarang harus menjadi fokus utama,"" tutupnya. Aksi ini melibatkan Kementerian Perdagangan (Kemendag), Kementerian Komunikasi dan Digital (Komdigi), Direktorat Jenderal Bea dan Cukai Kementerian Keuangan, Kementerian Lingkungan Hidup, Bareskrim Polri, dan Pemerintah Provinsi Daerah Khusus Ibukota Jakarta serta asosiasi hingga pelaku usaha. Serta beberapa asosiasi dan pelaku usaha yang memiliki komitmen sama di antaranya Gabungan Perusahaan Farmasi Indonesia (GPFI), Indonesian E-Commerce Association (IdEA), PT Perusahaan Perdagangan Indonesia (PPI), Asosiasi Perusahaan Jasa Pengiriman Ekspres (ASPERINDO), serta Perkumpulan Perusahaan Pemeriksa Keamanan Kargo dan Pos Indonesia (PAPPKINDO). "
Curhat Pria Lahir dari Donor Sperma, Bingung Cari Ayah Kandung;;https://health.detik.com/berita-detikhealth/d-8114689/curhat-pria-lahir-dari-donor-sperma-bingung-cari-ayah-kandung;2025-09-16 08:25:01;Seorang pria di Inggris merupakan salah satu anak yang lahir dari donor sperma.;"Seorang pria di Inggris merupakan salah satu anak yang lahir dari donor sperma. Ia dikandung melalui program bayi tabung atau In Vitro Fertilization (IVF) dengan donor sperma para tahun 2002. Sampai di usia 18 tahun, pria bernama Nat Allbut itu mengajukan permohonan kepada Human Fertilisation and Embryology Authority (HFEA) atau otoritas fertilisasi dan embriologi manusia untuk mendapatkan informasi tentang orang tua kandungnya. Allbut menerima berkas berisi detail tentang donor spermanya, termasuk tinggi badan, warna mata, profesi, dan kewarganegaraan yang meyakini bahwa itu adalah ayah kandungnya. Tetapi, dua tahun kemudian, hasil tes DNA yang ia jalani bertentangan dengan detail dari HFEA. ADVERTISEMENT SCROLL TO CONTINUE WITH CONTENT ""Ada tahun-tahun dalam hidup saya, di mana saya yakin bahwa saya memiliki latar belakang yang sebenarnya keliru,"" tuturnya yang dikutip dariIndependent UK.   Kini, ia menjadi salah satu dari banyaknya orang yang lahir melalui donasi sperma. Hal itu yang membuat orang-orang seperti Allbut bisa mendapatkan informasi yang akurat tentang orang tua mereka. HFEA, otoritas yang mengatur donasi sperma dan IVF di Inggris, mengaku sedang menyelidiki lebih dari selusin kasus. Mereka mengatakan kurang dari 20 kasus kesalahan informasi ini bergantung pada kualitas data yang diserahkan klinik. ""Masalah ini mungkin terjadi pada sejumlah kecil klinik donor pada tahun 1990-an dan awal 2000-an,"" kata pihak HFEA. ""Ini adalah masalah historis yang sangat spesifik,"" tambahnya.    Laporan HFEA menunjukkan lebih dari 2.800 anak lahir melalui donor sperma pada tahun 2019 di Inggris. Donasi sel telur, sperma, dan embrio menyumbang satu dari 170 kelahiran dan satu dari enam kelahiran yang menggunakan IVF di negara tersebut. Setelah Allbut menemukan bahwa detail yang diterima dari HFEA tidak cocok dengan miliknya, ia dicocokkan dengan beberapa kerabat dekat di situs DNA komersial lainnya. Di antara mereka, terdapat seorang yang terdaftar sebagai saudara tiri, yang menerima berkas dari HFEA yang menjelaskan siapa orang yang diduga sebagai ayah donornya. ""Saya menemukan daftar informasi yang sama sekali berbeda di Ancestry, yang tidak masuk akal karena tidak sesuai dengan berkas asli yang saya terima,"" beber Allbut. Namun, regulator awalnya mengklaim bahwa mereka tidak menemukan kesalahan apapun dalam informasi yang diberikan kepada Allbut. Tetapi, Allbut merasa mereka perlu bertanggung jawab atas apa yang terjadi. ""Saya pikir setidaknya mereka bisa mengakui bahwa mereka telah melakukan kesalahan dan memperbaikinya. Bukan hanya saya, orang lain juga telah menerima informasi yang salah,"" terang Allbut. Kepala Eksekutif HFEA, Peter Thompson, mengatakan ia ingin meminta maaf kepada Allbut atas nama pihaknya. Melalui pernyataan tertulis, HFEA mengaku menyesal atas ketidaknyamanan yang disebabkan karena informasi yang mereka berikan tidak sesuai dengan hasil tes DNA. "
Pastikan Indomie Aman, Indofood Soroti Beda Regulasi RI Vs Taiwan soal Etilen Oksida;;https://health.detik.com/berita-detikhealth/d-8114504/pastikan-indomie-aman-indofood-soroti-beda-regulasi-ri-vs-taiwan-soal-etilen-oksida;2025-09-16 06:25:04;Laporan kandungan etilen oksida (EtO) dalam Indomie varian Soto Banjar Limau Kuit belakangan memicu kekhawatiran publik.;"Laporan kandungan etilen oksida (EtO) dalam Indomie varian Soto Banjar Limau Kuit belakangan memicu kekhawatiran publik. Temuan tersebut dilaporkan otoritas Taiwan yang tidak mentolerir kandungan EtO dalam setiap pangan alias wajib nol terdeteksi, karena risiko masalah saraf hingga pemicu kanker dalam batas kadar tertentu. Corporate Secretary PT Indofood CBP Sukses Makmur Gideon A Putro menekankan pihaknya secara resmi tidak pernah mengimpor langsung varian tersebut ke Taiwan. ""Varian tersebut diimpor oleh importir yang bukan merupakan distributor resmi Perseroan, mengingat sampai dengan saat ini varian tersebut tidak dipasarkan di atau diekspor ke Taiwan,"" tegas Gideon dalam keterangannya di keterbukaan infomasi Bursa Efek Indonesia, dikutip Selasa (16/9/2025). ADVERTISEMENT SCROLL TO CONTINUE WITH CONTENT  Soroti Beda Regulasi RI Vs Taiwan Indomie bukan kali pertama tersandung kasus etilen oksida. Pihak produsen menyoroti adanya perbedaan persyaratan perizinan dan ketentuan keamanan pangan di RI dengan negara lain. Produk Indomie dinyatakan aman digunakan lantaran sudah memenuhi syarat izin Badan Pengawas Obat dan Makanan Republik Indonesia (""BPOM RI"") dan Codex Standard for Instant Noodles, yang juga telah mengantongi Sertifikasi Standar Nasional Indonesia (SNI).   ""Sedangkan persyaratan, peraturan dan ketentuan keamanan pangan di negara tujuan ekspor dapat berbeda dengan persyaratan, peraturan dan ketentuan keamanan pangan di Indonesia, yang juga senantiasa dipenuhi oleh perseroan untuk masing-masing negara tujuan ekspor termasuk Taiwan,"" lanjutnya. Pihaknya disebut akan terus berkoordinasi dengan BPOM RI dan otoritas Taiwan untuk tindak lanjut perkembangan kasus temuan etilen oksida yang dikhawatirkan memicu kanker dan gangguan saraf. Konsumen disebutnya tidak perlu khawatir, mengingat Indomie selama ini juga sudah dipasarkan lebih dari 30 tahun dan nihil masalah. ""Kejadian tersebut juga tidak memberikan dampak material pada kegiatan operasional maupun kinerja keuangan perseroan,"" tutup Gideon. "
